id,created_at,username,tweet
1060303094758682625,2018-11-07 15:48:51 MST,zillablue,"LOL the exit polling of Florida voters on Gun Control, Climate Change, Healthcare, Trump approval, Favorite Opinions were completely the opposite of who they voted for! Is it possible Republicans in Florida are like Oklahoma, they don't know WHO they voted for! Ha! #mtpdaily"
1060302902483283968,2018-11-07 15:48:06 MST,lisabloom,"Friends, we are not done. Lucy McBath is a powerful gun control activist who has more votes but her NRA endorsed opponent has not conceded and wants a recount. Lucy's son Jordan was murdered in an act of racist gun violence a few years ago. I just donated. Will you help too?"
1060302890458214400,2018-11-07 15:48:03 MST,mikofox,Online engagement on Reducing #ViolentCrime: A dialogue on #handguns and #AssaultWeapons  https://t.co/elxnuweNOw  #NFLpoli #NLpoli #PEIpoli #NSpoli #NBpoli #QCpoli #ONpoli #MBpoli #SKpoli #ABpoli #ABleg #BCpoli #YTpoli #NWTpoli #NUpoli #Nunavut #CANpoli #CDNpoli #GunControl #Guns
1060302770639527936,2018-11-07 15:47:34 MST,natiev2001,"The Dickey Amendment Says that the government funded Centers for Disease Control and Prevention agency can conduct research into gun violence, but cannot use government appropriated funds to do so. It was signed into law by President Trump on 3/23/18  DICK MOVE! @realDonaldTrump"
1060302690058727424,2018-11-07 15:47:15 MST,arra,"Censorship and Gun Control Will Not Make Us Safe: Dr. Ron Paulby Dr. Ron Paul: Sadly, but not unexpectedly, the…  https://t.co/q4rZRobMge"
1060302688531865600,2018-11-07 15:47:15 MST,gomoggle,"In my dream Jesus went to an NRA convention, And he wept tears of blood, But they threw a MAGA hat on him, And he watched the pretty show, Fell asleep with a hot dog in his mouth. Surrounded by Nazis in the beautiful South. #religion #dreams #faith #GunControl #God #poem"
1060302419031191552,2018-11-07 15:46:10 MST,_deardiaryyy,How is gun control not a Black issue when we are getting killed by police officers and other gun owners? How is pollution not a Black issue when... you know what 🙃
1060302205037756416,2018-11-07 15:45:19 MST,stephroets360,"I told him I liked Beto, but didn’t think he would win because Texas is gonna Texas. They may not like Cruz, but they don’t like someone who’s about gun control and abolishing ICE more.  He agreed that Beto was too radical. He wasn’t a big fan of Cruz, but he’s a conservative."
1060302123508715520,2018-11-07 15:45:00 MST,maroonsista,"wrote ""Predicting the unpredictable: When is a teenager just being a teenager? And when is their angst a sign that more destructive behavior is just around the corner?""   https://t.co/uYPbN7TeTZ  #schoolviolence #noviolence #guncontrol #schoolpsychology #Parkland #ParklandShooting  https://t.co/FRiDyqoozX"
1060301898861961216,2018-11-07 15:44:06 MST,paul_m_edwards,I liked a @YouTube video  https://t.co/vVACHuAw2L Weekly Update --- Censorship and Gun Control Will Not Make Us Safe
1060301825423892481,2018-11-07 15:43:49 MST,angel00lil,"@Buddy28066176 @bbusa617 @Winner_Freedom Wait until the democrat start to CONTROL YOU THEN  YOU CAN REALLY BITCH AND IT IS COMING SOON HEALTHCARE TAXES GUNS,NO BORDER,NO ICE,POVERTY,RAISE TAXES see the people who voted for them did it on what they were telling you, what they really meant was the total opposite GET READY"
1060301765642543106,2018-11-07 15:43:35 MST,davidnoland71,"One minute in, check out what are called her ‘scary’ policies: gun control, education for all, basic human rights for all...What’s scary is that anyone objects."
1060301209645404161,2018-11-07 15:41:22 MST,dryoung05,@realDonaldTrump @FLOTUS Safe?? Are you kidding me?? We're not safe until we have gun control &amp; not allow guns in mental people. And until you stop dividing the country.
1060301093479960576,2018-11-07 15:40:54 MST,spacewomanr,Washington state voters approve tough gun control measures  https://t.co/ozELYr13f8
1060300782296162304,2018-11-07 15:39:40 MST,disgruntledtrkr,Trump Helps Musicians - SA Gun Control  https://t.co/mXEuXcUkUr via @YouTube
1060300723081109504,2018-11-07 15:39:26 MST,kathia_woods,"@JaleesaLashay Get on the mailing list of your reps and senators and start tracking how they vote so come election time you can say repeat or fired. Folks say a lot I wanna know how you vote on stuff like education, healthcare, gun control, women reproductive etc"
1060300643737485317,2018-11-07 15:39:07 MST,steveklinko,Why have so many people lost their Minds? These mass shooters might not be so inclined to do what they do if they understood the full implications of the Inter Mind Model at  https://t.co/7sLiHwc5jg #MassShooting #SchoolShooting #ChurchShooting #SynagogueShooting #GunControl
1060300631397810176,2018-11-07 15:39:04 MST,davidyardley,So I find it interesting that my son's high school as part of St. Joseph Public Schools allowed 15 students to walk out again (like they did for a pro gun control walkout) this time on Election Day to protest a Trump...  https://t.co/np2vIFHlgu
1060300376530800640,2018-11-07 15:38:03 MST,dtalbeaux,"@danmardays @JohnWielgosz On their own, these are NOT unpopular causes. Quite the opposite. But Democrats let Republicans run the table. Much like they do with Roe v. Wade and gun control, both of which a majority of Americans support. But you'd never know it from the political discourse."
1060300363654488065,2018-11-07 15:38:00 MST,pewstates,Washington state OKs gun-control measure  https://t.co/YnHlhXVJMO via @dbeekman @NinaShapiro #WAleg #Midterms2018
1060300359472541697,2018-11-07 15:37:59 MST,bellaaagrace12,Four countries with gun control – and what America could learn from them  https://t.co/AS117vbd7u
1060300341453959168,2018-11-07 15:37:55 MST,brian_pignetti,@MattxRed You lost your own STATE. Get Real. Your handlers failed you. Learn from it. The last months your message got no coverage. Gun control was not even on anyone’s mind.
1060300162726158337,2018-11-07 15:37:12 MST,kehlcody42,@Viiivvvss @ElginMcklane I’m sorry if you’re that oblivious to not see the inevitable. Reality check this world is a crazy place and unfortunately we can’t control these acts of violence that nobody condones (including us who support gun rights).
1060300135488348161,2018-11-07 15:37:06 MST,debra40490421,"Dems need to educate and separate refugees from immigrants.  One policy does not fit all. Dems must be more specific on exactly what they mean when they use term ""gun"" control. Its up to us to reunite or except civil war."
1060300019373359105,2018-11-07 15:36:38 MST,limitedcents_,"@Joey_guzman8219 @tedcruz My opinion on gun control will not change and I doubt so will yours, as a gun owner myself I don’t see the need for assault weapons, it’s pointless. All it will do is cause tragedy. This comes from someone leaving to the marine corps soon. A assault rifle is a weapon of war."
1060299958635524096,2018-11-07 15:36:24 MST,ryanlongoria95,Idk why I enjoy laughing at people on Facebook so much who are losing their shit over new gun control in WA 😂😂😂
1060299823197315072,2018-11-07 15:35:51 MST,thomaskaempfen,"@NoahCRothman Much truth in this, and I say that as a liberal Dem. I suspect, that economic liberalism (single payer) doesn't doom these red-state candidates as much as cultural liberalism (gun control)."
1060299737507737601,2018-11-07 15:35:31 MST,nssf,"We’re seeing more of a mixed bag in the Congressional results, a changing landscape in the governorships and gun control advocates that spent big and claim victory. But that call might be a bit premature.  https://t.co/P3AQBSIydG"
1060299553432395778,2018-11-07 15:34:47 MST,rsshootinggirl,"@TheCBDiva @LShrug If you’re not advocating a law, then why did you tag gun control?"
1060299133200805890,2018-11-07 15:33:07 MST,rheekayleigh,"oh shit !! i totally forgot that as a democrat, i could never imagine believing in sensible gun control laws bc i think guns are just a figment of people’s imagination !! u hit the nail right on the head sis!!"
1060298839884738565,2018-11-07 15:31:57 MST,alwayslinderell,"@bryanbehar If you lived in Florida you'd feel differently. Exit polling showed Floridians support stronger gun control, action to deal with climate issues, restoring felons' rights to vote; &amp; yet, they elected two Trump sycophants in opposition to the views of the voters. Does not compute."
1060298770682912768,2018-11-07 15:31:40 MST,troy75801,"@drewduff96 @AlexandriaCrunk Ok,we can have a conversation. Well gun control ain't going to happen because it's a constitutional right so,that's 4 not. Equality of minorities,what does that mean, or what does he say that looks like?If u R a legal law abiding citizens or here as a guest, how R you not equal?"
1060298450292666369,2018-11-07 15:30:24 MST,wirewalker12,@jcbelgium Thank you for your feedback. It's the gun control and healthcare issues that are tripping me up. I believe the pros of  reforming these areas far outweigh the cons.
1060298366347816964,2018-11-07 15:30:04 MST,governing,"In year of Parkland and Pittsburgh shootings, Washington state voters pass comprehensive gun control  https://t.co/LdvEAj4Hl6  https://t.co/N7okG1rpUY"
1060298249301450758,2018-11-07 15:29:36 MST,maxman161,"@Bklyn_Born412 Doesn't matter, with a bigger majority in the Senate new federal gun control is going nowhere for at least 2 years."
1060298171904069632,2018-11-07 15:29:18 MST,checarina,"Congratulations to my home state WA for taking steps in the right direction on gun control and police brutality, steps which will save lives. Too bad those same lives will continue to be threatened by climate change which we've collectively decided to do nothing about."
1060298128807604226,2018-11-07 15:29:07 MST,saveourcountryy,"@TomSteyer We want healthcare, infrastructure, gun control, immigration.  STOP the impeachment talk.  Make the GOP say NO to good things for America."
1060297999933411328,2018-11-07 15:28:37 MST,brian_pignetti,@delaneytarr U think U R right but U R clearly fooling yourself.This was not UR message a year ago. Your handlers failed U.U lost focus. Only 9% of Americans said Gun Control was important 2 them.The state U live in rejected UR candidate.UR effort is Godly but not a winning 1. Learn from it.
1060297612748881920,2018-11-07 15:27:04 MST,jleetxgirl,"@bacon_texas @Mariatweets3 @DanPatrick Just DON’T bring up gun control again. We know how to get you outta there, Dan. You are still not fully trusted, since that incidence. 🤨🤨🤨"
1060297544151064576,2018-11-07 15:26:48 MST,bjbadger2wisky,"Look, it doesn't make a difference b/c they don't get to confirm gov't officials &amp; judges appointed by #Trump, it would require a 2/3 majority to hand him a Guilty verdict &amp; any legislation like #GunControl &amp; #NetNeutrality bill, the #GOP Senate can kill it."
1060297494330929152,2018-11-07 15:26:36 MST,genessakrasnow,@jordanharb And Felons in FL can vote in elections. That's real real big. Plus Gun Control in WA State. Also big. And no Scott Walker!
1060297249362796544,2018-11-07 15:25:38 MST,simongf2,@APurposefulTrap This ia why we need gun control. Grrrrr
1060297156492517376,2018-11-07 15:25:16 MST,harr1sona,"@flvssocialproj1 Gun violence is bad, but gun control won't fix it."
1060297067648696325,2018-11-07 15:24:54 MST,jamesmkag,Republicans Make Senate Gains as America Rejects Gun Control Again  https://t.co/aqjTCUaSew via @BreitbartNews
1060296597781667841,2018-11-07 15:23:02 MST,radiomattm1,@MeredithMarsha1 @Patriot988 @BreitbartTexas Mexico should have gun control!
1060296543469633536,2018-11-07 15:22:49 MST,dholley1954,@loisbeckett @JoyAnnReid Babe that just Means there is more hard work to be done ✅ God is Amazing the nra will not win this war on guns  I truly believe Love Is stronger in Heart then hate in mine 🔑🔑🔑🔑🔑🔑🔑🔑🔑🔑🗳 America needs gun control
1060296507570692099,2018-11-07 15:22:41 MST,ubfriccardo,"@theamandabatty I can't read the article, it's not available outside the US... but I have to say, healthcare is one of the two things that look absolutely crazy about the USA from over here (gun control is the other)."
1060296459805908992,2018-11-07 15:22:30 MST,walther_cathy,@CraigRSawyer   Me again!  I wanted to show you my gorgeous black lab named Jinx giving her views on gun control!  I hope you enjoy!  https://t.co/fnnZbUMSNb
1060296265991417857,2018-11-07 15:21:43 MST,jazmine2499,"If someone wants to hurt people they will find a way to do so, no need for gun control....u can literally make a pipe bomb just going to home depot people wake tf up😩"
1060296085254627328,2018-11-07 15:21:00 MST,benjamindemers,"Ron Paul: Censorship, Gun Control Will Not Make Us Safe   https://t.co/vHxWCXuusc"
1060296012521263104,2018-11-07 15:20:43 MST,hurst36,"@DavidFrost95 @shouldITbonfire @scumjones @cjane87 @benshapiro Stricter gun control, Justice reform that is equal to all, eliminate the bail system that favours rich white people, health care for all, better mental health coverage, pre existing conditions to I need to list anymore that benefit minorities and all people? That is liberal."
1060295954073640960,2018-11-07 15:20:29 MST,mac2u,Voters in WA State Pass Massive Gun Control Initiative   https://t.co/jxjWIdKVGh
1060295624531165185,2018-11-07 15:19:10 MST,sinfulweeknd,Gun control is cool or whatever but i really wanna get one  https://t.co/akmAf8sNX9
1060295232279834624,2018-11-07 15:17:37 MST,steven_seegel,"@jmjafrx @mimoyd1 Joe Neguse ran a tough, smart campaign against Peter Yu, also the son of immigrants (from China). Gun control was a big issue. He's the 1st African-American Congressman in CO &amp; he'll fill Polis's reliably Democratic seat in the House. More ppl should pay attention to his talents."
1060295106564108288,2018-11-07 15:17:07 MST,muskieruskie,"@dbongino @NRATV ""Gun owners have the same value system that all Americans do, which is that we want to keep our families safe."" These Pro-Gun Families Have Surprising Views on Gun Control  https://t.co/znmUR3q3BY via @vice"
1060295038792581121,2018-11-07 15:16:51 MST,bellobrunelli,@DonHubbell2 @PaulaJo41820905 @ProGunMatt @ChuckCallesto @pearl_of_truth USA does not have National Gun Control System!  https://t.co/Ls4og4Qtuc
1060294750824210432,2018-11-07 15:15:42 MST,jimmeeks13,Weekly Update --- Censorship and Gun Control Will Not Make Us Safe  https://t.co/6xiFPE91mP via @YouTube
1060294652723716098,2018-11-07 15:15:19 MST,nightowl11683,@MaikSowinski @BrettKollmann Not happening any time soon. Any Texan that tries to get elected preaching gun control &amp; reducing border security will lose in a statewide election.
1060294538919665664,2018-11-07 15:14:52 MST,nickdeoliveira_,"@EhretsAPGov Voter ID, Gun Control, Immigration, etc. shouldn’t be partisan issues. We need to stop the party alignment from making our choices for us. Where are the candidates that propose solutions for everyone? PS - Twitter character limits are awful. #usefacebook"
1060294446980456451,2018-11-07 15:14:30 MST,bibleprofessor,"Gospel Snippets: Gun Control? How About ""Tongue Control""  https://t.co/gZZzdGu08J"
1060294144390762499,2018-11-07 15:13:17 MST,portiacbs,Need a wave of #guncontrol laws
1060293912940740609,2018-11-07 15:12:22 MST,michaelzee0,"@RoyBlunt If you really cared about kids you would promote sensible gun control, but no, you won't do that like the NRA fills your pockets with cash. Blunt is bad for Missouri, bad for the nation."
1060293761924825095,2018-11-07 15:11:46 MST,truthsavesusa,@JoyVBehar And two repubs who likely won't amp up gun control. Parkland students helped others and lost their own state's races. So sad.
1060293511600164864,2018-11-07 15:10:47 MST,retroition,"@adam_denker Me too, but I also know she lost when she came out pro gun control. Lost her the moderates AND the far left. Can't win on gun fearing liberals in Montana."
1060293259715534848,2018-11-07 15:09:47 MST,donnam53881887,"Well now the Democrats have something to work  and strive for! Not to impeach a president, but to take all his MASKS off! He wears many masks! One he shows HE care about the U.S !Mask he shows About how bad he feels sorry for kids that got killed because of gun control ! The Mask"
1060293174772535303,2018-11-07 15:09:26 MST,dcl_60,"We still have along way to go on gun control, but this is great!!! ✊🏼💙 #NeverAgain  https://t.co/HoKhkhmsOL"
1060293043587293185,2018-11-07 15:08:55 MST,ginosorcinelli,"@Behler_Acts1711 Ummm, one of the main reasons people like you mock them is for their views on gun control, no? They survived a tragedy involving guns and spoke out on an issue they were passionate about. You don’t like their views so you mock them. How do you not see the connection there?"
1060293027263078403,2018-11-07 15:08:51 MST,chopshopchi,We're hosting a free exhibition from @JRart &amp; @TIME facilitating an honest conversation about gun control on Wed. 11/14. RSVP &amp; learn more &gt;&gt;  https://t.co/HiKOVBwOuC  We have $1 oysters 5-7pm and half-off bottles of wine every Wednesday! Reserve a table &gt;&gt;  https://t.co/pLTULUCRDJ
1060292903178854400,2018-11-07 15:08:22 MST,onda_blu2020,"@davidhogg111 So sorry, David. I thought of you and all your hard work last night. I feel America let you all done by not making gun control a higher priority. 😢 Keep working hard on this. So many of us “grown ups” have your back."
1060292658525102081,2018-11-07 15:07:23 MST,dfutoryan,"Assembly Speaker Carl Heastie laid out an agenda for the coming 2019 legislative session – an agenda that can pass with more pieces intact due to the coming state Senate Democratic majority – including strengthening abortion and gun control laws,...  https://t.co/A1fbWmkxUO"
1060292589512024070,2018-11-07 15:07:07 MST,samswey,So many things could be put on the ballot that would pass in major states and would cost a fraction of what is given to candidates for statewide office (who don’t even always win). Medicaid expansion. Minimum wage increases. Police reform. Elections &amp; voting reform. Gun control.
1060292522340163584,2018-11-07 15:06:51 MST,nick_flipp2,"gun control is the gay 🍊 🍼 🔫 Good luck, -flippo"
1060292414814982145,2018-11-07 15:06:25 MST,dfutoryan,"Gov. Andrew Cuomo said the coming Democratic majority in the state Senate will enable the passage of a range of long-sought bills covering ethics legislation, abortion rights and gun control, State of Politics writes.  https://t.co/ABR4YkVSqi"
1060292126607585280,2018-11-07 15:05:16 MST,lokiluck3,"I uploaded a new episode, ""Israel Lobby Used Fake Sexual Assault Claims Against BDS Activists +"", on #spreaker #bds #boycottdivestmentsanctions #censorship #demoniacresistance #edwardsnowden #freespeech #guncontrol #gunrightssancutary #iheartradio  https://t.co/jhEJ7sw223"
1060291617553346560,2018-11-07 15:03:15 MST,beigegalaga,"@suitablegirl Next district over from where I live. A grad school friend’s husband tried a write-in campaign as a mod-Republican (against ACA repeal, for gun control laws) but couldn’t get any traction."
1060291496837070850,2018-11-07 15:02:46 MST,spacemaned,@tomforutah @Patbagley @realDonaldTrump Bad time to talk gun control.
1060291404080074753,2018-11-07 15:02:24 MST,dawniscomingtoo,@AliciaHollinger @PamLighaam @RepAdamSchiff No way.  Trump's supporters have guns and ammo. Trump can not control them and never could.
1060291250677518336,2018-11-07 15:01:48 MST,jkuitunen,The #youthvote came out for #Midterms2018 because they profoundly disagree with this administration's stance on #GunControl #ClimateChange #LGBTQRights #Immigration #WomensRights #Racism and a multitude of other issues. No not compromise their values by compromising with Trump!
1060291130993057793,2018-11-07 15:01:19 MST,mndemsvolunteer,"Headlines @startribune, From 11/17/16 Erin Murphy enters the race, 3/27/17 Tim Walz joined the race, 10/5/17 Tim picked Peggy Flanagan, to caucus night, to gun-control opinion piece, to state convention, to primary election, to November 6 and victory!  https://t.co/2Qcxjbp5VL"
1060290888146944000,2018-11-07 15:00:21 MST,apatheticpath,"It's a shame seeing my home state pass even more restrictive gun control legislation last night. I've voted for stronger background checks &amp; (what I consider) acceptable waiting periods in the past, but I'm now worried the state is trying to send a very partisan-biased message."
1060290783100706816,2018-11-07 14:59:56 MST,cbsthismorning,Voters in Washington state approved one of the toughest gun control laws in the country.   https://t.co/N77CrAHh50
1060290720794198016,2018-11-07 14:59:41 MST,vojtech_kouba,"@corobluis @Ryanair You want to improve plane security, get rid of pilots by autonomous flight control! Then, let us all fly with scissors/guns in peace without the risk of taking over plane, while making airport security checks unnecessary, thus cutting hours of wasted passenger time."
1060290676095639558,2018-11-07 14:59:31 MST,ourgunfreedoms,The 2018 midterm elections may have exposed a shift on gun control -  https://t.co/H3fwC0n2cE
1060290503441309696,2018-11-07 14:58:49 MST,3820ct,"@RealJamesWoods @NancyPelosi and they need to stop talking about cutting Medicare, social security or means testing. They may have to deal with the gun control  https://t.co/QP5fNjwifG return for wall"
1060290441386414081,2018-11-07 14:58:35 MST,unintendedmax,@davidhogg111 Looks like no one voted in line with your twisted gun control agenda.
1060290422508060673,2018-11-07 14:58:30 MST,mr_smithsonian,"a gun control advocate won in the back woods of fucking georgia  i better not see ONE SINGLE DEMOCRAT ever fucking complain again that a candidate is ""too liberal"" to be run in a state ever again"
1060290309219934208,2018-11-07 14:58:03 MST,mtneedle,Stunning loss for NRA: Jason Crow beats GOP incumbent congressman -- running on gun control  https://t.co/D3nSEqY3L5
1060290297668734976,2018-11-07 14:58:00 MST,cheekyrando,"in other news, mcbath may have won a republican seat running on gun control, after her son was killed by a guy who was annoyed about his music  https://t.co/IgW8AbmWOe"
1060290288839618560,2018-11-07 14:57:58 MST,lastamerhicans,You must be this retarded to work in the #government. #Senate #GunControlNow #GunControl #NRA  https://t.co/VUNZvcH4uR
1060290251355119617,2018-11-07 14:57:49 MST,ycemmy96,"It still blows my mind how 16 year olds from Parkland have become gun control activists reaching thousands of people through Twitter. When I was 16 I sometimes tweeted 70 lyrics a day, made vague references to my day that only a few people would understand and alot of subtweets"
1060290106555330571,2018-11-07 14:57:15 MST,snarkvol,"@Michael12246469 @SaysSimonson @seanmdav I agree with you totally. I just don't think gun control is the answer, BUT I do think that we need to be more concerned with finding and implementing effective safety measures to stop any terrorists who would do this on American soil."
1060290076058501120,2018-11-07 14:57:08 MST,bassproshop93,Until Democrats learn that gun control and open borders are losing issues you all will continue to be disappointed. Not the sword to fall on champ.
1060289580102893569,2018-11-07 14:55:09 MST,dstroyr_u2b,@AdamPiersen @Cat13252228 @FrankySpaas @petenelson277 @LindseyGrahamSC @realDonaldTrump You're surprised that #gunsense/#guncontrol is exercising a double standard?  I thought that is their standard 😆
1060289541691465729,2018-11-07 14:55:00 MST,bosumboy,Please keep up your great work. Sensible gun control is needed to stop the the horrible loss of life we have experienced.
1060289233263513605,2018-11-07 14:53:47 MST,laflorhes,"“It’s not about politics it’s about respecting others beliefs” let me just say something really quick. How the FUCK am I going to respect someone beliefs on not having gun control, separating families, not supporting LGBTQ+, not for women equality, etc. Do you realize what you"
1060289212484730882,2018-11-07 14:53:42 MST,larsonelainem,"Those individuals bent on control and destruction of the United States of America have gone after our unity, religion, guns, our anthem and now the symbol of our Great Nation!   https://t.co/fEBDzUDM0o"
1060289050148429825,2018-11-07 14:53:03 MST,brokehrtliberal,Also the front iron sights are obscuring the optics....ROFMAO  #GunControl #2A  https://t.co/pZ0IRsbrtt
1060288805163450369,2018-11-07 14:52:05 MST,willoworwill,"@sandersism @ColtonWinters_ Nor should it be, IMO 🤷‍♀️. While it’s great to be civil, empathetic and respectful, I don’t think it’s nescessary to be BFF’s with someone who disagrees with you on whether women deserve control over their bodies, who deserves to live in your country or whether guns are a problem"
1060288760225718274,2018-11-07 14:51:54 MST,meg_e_t,@StephenAtHome this has been bothering my today: @ChrisMurphyCT is the senator who filibustered for #guncontrol. He's a leader on #healthcare too. Have him on the show - you should get to know him! Congratulations Chris!!
1060288739820204032,2018-11-07 14:51:49 MST,brokehrtliberal,&gt;Upside down carry handle What is it with #GunControl advocates and weird accessories on guns?  #2A  Via @macho_gomez_  https://t.co/Ku2NoeakOi
1060288631892365312,2018-11-07 14:51:23 MST,chuckdog00,@TreGreen2 I’m sayin. He took his shit way too serious 😂. Like I’m for the gun control and I fw guns heavy but this man jus sounds big hurt.
1060288516083470336,2018-11-07 14:50:56 MST,atx787021,"Certainly! Red Tide, rampant racism, out of control gun violence. Come to CA! Yosemite, beautiful, unspoiled sea coast, any climate you want any time of year!"
