id,created_at,username,tweet
1060288512652505093,2018-11-07 14:50:55 MST,robertpatton14,"@Johnmic33835924 16 inch guns and, yes, a pity the old batttleships are gone. I was never stationed on a battleship, just went aboard a couple (New Jersey, Missouri) many years ago in port. I was in Sydney in early 2000 on a Command and Control ship, USS Blue Ridge."
1060288416317874178,2018-11-07 14:50:32 MST,dstroyr_u2b,"@Cat13252228 @AdamPiersen @FrankySpaas @petenelson277 @LindseyGrahamSC @realDonaldTrump I can open carry/conceal carry an MG42 without a license if I want  Anyone here who tries to enforce #gunsense/#guncontrol will be imprisoned &amp; fined  My state is top 5 of most #guns owned  Yours isn't in the top 15, sweetie  https://t.co/x6WYyZVjwQ  Texas has nothing on my state"
1060287743962595328,2018-11-07 14:47:52 MST,bradachristie,@DamianEdwards 2nded. Adding #GunReformNow #GunControl for good measure.
1060287730385473536,2018-11-07 14:47:48 MST,obscureshadow3,Weekly Update --- Censorship and Gun Control Will Not Make Us Safe  https://t.co/aJMLd4jMKC via @YouTube
1060287729504788482,2018-11-07 14:47:48 MST,bryanpleasestop,"This is a good article but premise is dismissive - @BetoORourke wasn't close to progressive majority in TX. That's significant. Not to mention progressive initiatives (gun control, increased health insurance, etc) generally poll well nationally. @davidfrum  https://t.co/ENT5hYbP8s  https://t.co/5CTE5H1JnI"
1060287708419940352,2018-11-07 14:47:43 MST,watti0608,@guncontrol_rick 神った
1060287149583618048,2018-11-07 14:45:30 MST,knowledgemasta,"@_seize_the_carp @CoreyL55 @BrianKempGA the words ""i'm coming for your guns"" never came out of her mouth...if you understand how legislation is created and negotiated on, then you will see that this is simply a scare tactic used against someone who is for sensible gun control legislation.  the rest is just bullshit"
1060287028716363777,2018-11-07 14:45:01 MST,ecu_alum,@tvn_Red @AbundantPatrice @montanamajik @daralynn13 @jeff_ucsu98 @chrislhayes I'm thinking the women's marches and the protests for Gun Control are pretty good indicators that if pushed far enough people will act. I could be wrong though...
1060286905449963522,2018-11-07 14:44:32 MST,americanshomer,Republicans Make Senate Gains as America Rejects Gun Control Again  https://t.co/QhQgd5knG3 via @BreitbartNews
1060286842040393728,2018-11-07 14:44:16 MST,navigatingtrump,"New post: ""Gun control lost in Florida on Election Night, but student activists vow to fight on""  https://t.co/IF19fR34yC"
1060286771643273217,2018-11-07 14:44:00 MST,cinemava,"Dems get ready to fight and Oversight. You can multi~task. This is why we put you there. Healthcare, immigration, gun control and starting impeachment proceedings.  https://t.co/mrjESfAZUi"
1060286764743618560,2018-11-07 14:43:58 MST,overtonw1ndow,"Love discussing gun control in my classes, every stats extremely level headed and reasonable"
1060286643184254977,2018-11-07 14:43:29 MST,koketokyo,Gun control advocates score major victory in Washington  https://t.co/QrN07vqATo
1060286551370928129,2018-11-07 14:43:07 MST,tonystech70,Joe Rogan - Ted Nugent on Gun Control  https://t.co/2SBhp8xQ60 via @YouTube
1060286466859917312,2018-11-07 14:42:47 MST,marie5483,"@TalbertSwan I just had a friend, a retired senior, text me that she was embarrassed of Florida voting for DeSantis yesterday! I expressed my dismay at a state of seniors voting for a man who voted against pre-existing conditions &amp; she reminded about gun control too! Sad!"
1060286375512158209,2018-11-07 14:42:25 MST,mydestinnyyyy,"I feel like this is where a lot of people get confused. It’s not that we don’t support guns, we just support gun control 💁🏾‍♀️"
1060286138416533504,2018-11-07 14:41:29 MST,denisemasterson,"Matt miller is calling for us to hit the streets in protest. I am not sure this is safe. Trump supporters have shown themselves to be gun toting crazies and alt right groups, that could be a blood bath. ARE WE NOT PAYING OUR TAXES FOR CONGRESS TO TAKE CONTROL?"
1060285992681107456,2018-11-07 14:40:54 MST,samwise206,"@a_man_in_lunacy @TheRealThabo @TheMattHolt So is shooting children in schools, but that doesn’t seem to be stopping people with access to guns... which is why we need common sense gun control laws to keep people safe. I guess I value their lives more than you do..."
1060285785721585664,2018-11-07 14:40:05 MST,nickriccardi,"Point of personal privilege here, I called Tom in the hideous hours after his son was killed in the Aurora Theater shooting. He was the rare person who was just everywhere after such an appalling nightmare, He went to all the gun control press conferences. He was at the trial."
1060285620172447746,2018-11-07 14:39:25 MST,makiwi,"Also when talking about US politics vs. politics in other “democracies” keep in mind certain things that are always contentious in the US simply aren’t elsewhere, eg abortion, universal healthcare, gun control"
1060285030918963201,2018-11-07 14:37:05 MST,richardactor17,@amandacarpenter And I'm ok with not having those voters as part of the Democratic coalition. Time and again it has been proven the economy was not the deciding factor in people voting for Trump. Neither was gun control. Keep pretending it wasn't something else.
1060284993296044033,2018-11-07 14:36:56 MST,xmrguppy_za,@Ragnarly No. But worth noting that in SA police officers and ordinary citizens are regularly killed specifically to rob them of their firearms. Perhaps an argument against our strict gun control.
1060284884155949056,2018-11-07 14:36:30 MST,jenhnwmon,"@markos Florida granting the right to vote to over a million disenfranchised people!!!!  Washington State overwhelming passed new gun control legislation (raised age limit as well as stricter background checks, training and a 10-day waiting period to own a semi-automatic)!!!!"
1060284853495779331,2018-11-07 14:36:22 MST,jayshams,He's also opposed to gun control and is a climate denialist. So there's that.
1060284681671700480,2018-11-07 14:35:41 MST,saltliick,"Feeling rly happy about some election results and really doomy about others. Gun control and police reform, yeehaw, but ppl don’t care for the environment? lol. Not going to have anyone to protect when the world ends 😲 🔥"
1060284530811195393,2018-11-07 14:35:05 MST,gunbuyersclub,"#guns #2A Will Washington's I-1639 gun control measure face a court challenge?: (AP) Now that Washington state’s sweeping gun control measure I-1639 is likely passing, it could end up facing a court challenge from gun rights acti  https://t.co/qqhLOYT6xs  https://t.co/0iF5eTx3yd"
1060284445205430275,2018-11-07 14:34:45 MST,xthinkerxx,@EWErickson Thank God. Still hard to believe how many Georgians voted for gun control and sanctuary state status.
1060284260467204098,2018-11-07 14:34:01 MST,duddun,"@SarahEMyhre Unfortunately, politics of fear are effective. Too many people are focused on non-issues (e.g. the caravan of mostly women and children walking from Central America to our border with the goal of applying for asylum) and not on the real ones (health care, gun control, etc)"
1060283895629955072,2018-11-07 14:32:34 MST,emotionlnside,Birth control pills should be for men. It makes much more sense to unload a gun than to shoot at a bulletproof vest.
1060283769402228736,2018-11-07 14:32:04 MST,tami_allen2,@shannoncoulter 💙WA passed really strong gun control legislation and a measure that increases police accountability. We also increased our legislative majority in the state. And flipped a house seat that had NEVER been held by a democrat!
1060283678897700865,2018-11-07 14:31:42 MST,demandor,"@amandacarpenter Racism,sexism,homophobia, loose or no gun control are their interests"
1060283668961419264,2018-11-07 14:31:40 MST,zig_xag,Imagine if a white person said the same thing.    “Ban guns. We need more gun control. White privilege”
1060283622429786120,2018-11-07 14:31:29 MST,jackie0351,Candidate C supports tougher gun control even though he’s making money off of gun runners. Candidate F supports socialism and really sticking it to the 1% even though they got 3 multimillion dollar homes
1060283556881203232,2018-11-07 14:31:13 MST,kenhll555,"@Bry_Sanchez @DanielSchoel @dwreck333 @cnnbrk Rebranding a turd sandwich as a hamburger does not make it tasty. What is the difference between Nazism and Democrat Socialism? Control of manufacturing, control of healthcare, gun control. One word in common “control”"
1060283298386190337,2018-11-07 14:30:12 MST,nybackpacker,"@AndreaSCousins   I expect you to not be a pawn and rubber stamp for @NYGovCuomo who hasn’t delivered a democratic vision for NYS  Tackle voting rights, corruption, abortion rights, gun control, and allow undocumented ppl tuition assistance.  Everyone will be held accountable"
1060283281369956373,2018-11-07 14:30:08 MST,jacobsullum,"Federal judge declines to dismiss the NRA's First Amendment lawsuit against Andrew Cuomo, saying it's plausible he abused his regulatory powers to launch an unconstitutional assault on people who disagree with him about gun control.  https://t.co/9jkUDfkCO3"
1060283259999858689,2018-11-07 14:30:02 MST,reason,"Federal judge declines to dismiss the NRA's First Amendment lawsuit against Andrew Cuomo, saying it's plausible he abused his powers to wage an unconstitutional vendetta against people who disagree with him about gun control.  https://t.co/wJIpzLZwSu"
1060282967531053056,2018-11-07 14:28:53 MST,spillanemj,@ThaiJ1226 @MattWH03 @manicmess911 @JohnFohf @Bedollz @SarahKSilverman Australia is the country that’s been referred to in many US gun control campaigns
1060282921695744000,2018-11-07 14:28:42 MST,lexihowenstine,These are the same kinda men that will die before we let more strict gun control rules help save lives in our country but how dare you carry pepper spray when Chad can carry a gun 🤦🏼‍♀️
1060282897545003009,2018-11-07 14:28:36 MST,dix_iechick,"@ReaganBattalion @NymanShelley Yes, even in Texas. Us gun owners in Texas still don’t want crazy people buying unlimited guns or kids getting murdered. My husband has his concealed carry license, is a Republican, army veteran, and still believes in reasonable gun control. Because he has sense."
1060282808365694976,2018-11-07 14:28:15 MST,maryanngreanier,"@markos Because the Senate, through confirming members of the judiciary, will have a profound effect on civil liberties, women's rights, LGBTQA+ rights, climate change, healthcare, 1st Amendment, gun control, etc., for generations. We did well, but we need to do better. #Election2020"
1060282807522549760,2018-11-07 14:28:15 MST,madisenkieffer,If you’re actually mad about a common sense gun law passing that doesn’t even affect responsible gun owners and you’re just mad that anything pertaining to gun control is gaining traction then honestly fuck you idk what else to say
1060282713087901703,2018-11-07 14:27:52 MST,benardeart,"@Lawrence    Here's a link about my son  Scott Benarde (Communications Director of The Norton Museum, Palm Beach, Florida)  about GUN CONTROL....He has even written a song / now on Facebook .  abstudio@comcast.net"
1060282683601735680,2018-11-07 14:27:45 MST,samvoeller,I had a peaceful Facebook conversation about gun control with friends of mine who I know lean right. It was super helpful and informative. Remember you don't have to agree in the end but if you take time to listen it will be easier to find a lasting bipartisan solution
1060282116011933696,2018-11-07 14:25:30 MST,lexierose99,"@JoshuaStrode2 @carissa_michele i never said it was one. what i said was that while Beto is all for the restriction of weapons of war, Cruz is not. he could care less about gun control. i said it would be harder for someone to go and buy an ar-15 if there was more control over guns."
1060281983194943488,2018-11-07 14:24:58 MST,christreformedu,"USA: Keep us safe.  God: Common sense gun control.  USA: Pray for Victims, Have mercy.  God: Gun Control!!!!   USA: Why don’t you keep us safe?  God: You are NOT listening to me."
1060281864022360070,2018-11-07 14:24:30 MST,forbes,"The late Microsoft cofounder Paul Allen is leaving behind another legacy—helping his home state enact stricter gun control.  He donated millions in support of Washington’s Initiative 1639, which won with 60% of the vote  https://t.co/eX798yz21v  https://t.co/pfTCemtA4b"
1060281858431352841,2018-11-07 14:24:28 MST,angelam111408,@deezala1 @DykstraDame @realDonaldTrump And God forbid we mention gun control!!!! Automatically means we’re gonna take all guns away! Trump has won by playing into the racism and ignorance of this country and it worked!!!! It’s sickens me
1060281256238170114,2018-11-07 14:22:05 MST,jasonrantz,Will Washington’s I-1639 gun control measure face a court challenge?  https://t.co/0qSb53iP1k
1060281048901320709,2018-11-07 14:21:15 MST,mrbill3626,Republicans Make Senate Gains as America Rejects Gun Control Again.   https://t.co/z0uCKHNK5Q
1060280998795984896,2018-11-07 14:21:03 MST,therover1968,"@delaneytarr Washington State voters passed significant gun control legislation by an overwhelming majority.  You have inspired, not failed.   @AMarch4OurLives"
1060280816947945472,2018-11-07 14:20:20 MST,thedailydigest,Republicans Make Senate Gains as America Rejects Gun Control Again  https://t.co/BeauSgezR3  https://t.co/BpQjjN5pwY
1060280771531993088,2018-11-07 14:20:09 MST,closguerr3ro,"@troncozo_jesus @HarleighJuarez Do you realize that what Robert o’rourke supports will not help our country at all, an open border would allow terrorist organizations to flood in with no limits, gun control would take guns out of the good guys hands, and raising the minimum wage would cause major inflation."
1060280684542070785,2018-11-07 14:19:48 MST,brattycapricorn,"@NobodyN8 he’s pro choice, wants more gun control, no wall (i think it’s a waste of money), and legalization of marijuana"
1060280671032262656,2018-11-07 14:19:45 MST,iamit4life,Republicans Make Senate Gains as America Rejects Gun Control Again  https://t.co/CyURvvlCRv via @BreitbartNews
1060280511107661832,2018-11-07 14:19:07 MST,masterfulcinema,"@oblivious_dude @rortybomb The definition of moderate Dem has shifted in 12 years. M4A and Women's Choice is a standard as well as gun control. Not the case in the old ""Blue Dog"" days."
1060280386499022848,2018-11-07 14:18:37 MST,tommiesunshine,"I'm curious what it will take for the average American to protest. I've been in Occupy, BLM, Standing Rock, Muslim Ban, DACA, Gun Control &amp; general anti-Trump protests. was in DC on Inauguration Day &amp; again for the Climate March. what have you done? when does your outrage begin?"
1060280265044574208,2018-11-07 14:18:08 MST,andrewidy,@KlairhA Just had a closer look at the photo. Presumably the Cretan palikaria were looking for a destination with liberal gun control😉
1060279886349324288,2018-11-07 14:16:38 MST,jiminieworld,@jjksgcfs gun control
1060279814236459008,2018-11-07 14:16:21 MST,pemdas_gamedev,"Just had a gun control debate that was civil and we stayed friends at the end.   Why can't @SenFeinstein and @SenateMajLdr lead their parties in a reasonable, respectful conversation (about anything, really)? We don't *have* to vilify those with different position points, do we?"
1060279652172722176,2018-11-07 14:15:42 MST,thedailydigest,New article (Republicans Make Senate Gains as America Rejects Gun Control Again) has been published on The Daily Digest -  https://t.co/jx7HCW9ujZ #WalkAway  https://t.co/BOVHRU2S2O
1060279615640395778,2018-11-07 14:15:34 MST,dscheberle,"@loisbeckett Young people should be so proud of what they accomplished. Florida will come around and #ActOnClimate and gun control. Keep fighting, you inspire us."
1060279535986368513,2018-11-07 14:15:15 MST,_dredre,"@GiselleGarcia13 You’re right. It honestly just depends on what’s being passed. I don’t believe in gun control (conservative view), I believe women should be able to have abortions (liberal view) I won’t go into the rest because people are too easily offended by other’s opinions"
1060279526947782656,2018-11-07 14:15:12 MST,retief_99,Surprise: Physician Group Rehashes Same Tired Gun Control Policies -  https://t.co/4APiWGYAOP @nraila
1060279493401739277,2018-11-07 14:15:04 MST,joefd,"@JamesDMorris I don’t know anything about US politics but single payer/ medicare for all would be cheaper overall than the status quo. This argument needs to be faught and won, surely. Just like gun control. These aren’t dangerous radical policies."
1060279367807320064,2018-11-07 14:14:34 MST,cyborgk9,"@KovaSheppy @vexwerewolf @Squiggles_Folf So… if you're not on board with the GOP's LGBTQ policies, what is it that they're doing that gives them your vote? Tax cuts for the rich? Anti-immigration and racist policies? Resistance to sensible gun-control laws? Ignoring the greatest environmental threat to humanity? :P"
1060279333120602112,2018-11-07 14:14:26 MST,soda_renewed,We believe in gun control ✌🏼
1060278882203385856,2018-11-07 14:12:39 MST,ketaminh,@chuckleheimers @foreveryearning @SensitiveSoulRN @TrailRN610 @DrGRuralMD @kayrundel0 @LMTDoulaSarah @AnonEmpathRN @PetalConfetti @emergency_CNS @dlindgrenmd @Linndhop @c3convertase @_pillsandblades @noob_medic @Mummin8r @Ivy_RN1 @maureen_ferrari @KatbeeFulgenz @megaholt @mamasahotmess04 @AllDayERDayRN @maie_lynn @alexsrobin @MSWSHAWN @PharmaKittyCPhT @ImTheMom_TaDa @maryking1948 @writing1977 @hangingoninquie @BrowofJustice @Jemc613 @GongGasGirl @DocPNW @introvertBSNRN @reepRN @thepondinthebox @Mandy_RN13 @drlfarrell @Darn_if_I_know @haydenwwest @coffeeNCalibers @EMdocinabox @SarcasticLatte @Swoopy @Potato_Chip @peggykilty @RedTriage @teenytinydino22 I was joking about moving onto gun control !
1060278677164908544,2018-11-07 14:11:50 MST,thereallizkelly,"@Vonnie320 @LoveAlw28s @johnlegend My Father is 77 years old, my Mom is 64. They have both said that they would NEVER vote for him again. He’s violated so many of our rights that it’s insane. The way he talks about women, the LGBTQ community, immigrants, lack of gun control. . They are pissed."
1060278546558525440,2018-11-07 14:11:19 MST,cybertronguy98,"@Laurelei_Lee you know what, i can deal if you dont support healthcare or criminal justice reform. i can even let you get away with not supporting gun control even if i think that does make you dense. but if your racist/sexist/homophobic/whatever that's where you lose me."
1060278456817254408,2018-11-07 14:10:57 MST,noveltysweaters,look what my 8 year old son found under his shoe today 😔 we need gun control now  https://t.co/96x5Klo24z
1060278452761387008,2018-11-07 14:10:56 MST,david14vielma,"Y’all be saying that tighter border control will stop illegal immigration, but for some reason tighter gun control won’t stop mass shootings 🤔🤔🤔"
1060278291746017280,2018-11-07 14:10:18 MST,mummin8r,@ketaminh @TrailRN610 @foreveryearning @chuckleheimers @SensitiveSoulRN @DrGRuralMD @kayrundel0 @LMTDoulaSarah @AnonEmpathRN @PetalConfetti @emergency_CNS @dlindgrenmd @Linndhop @c3convertase @_pillsandblades @noob_medic @Ivy_RN1 @maureen_ferrari @KatbeeFulgenz @megaholt @mamasahotmess04 @AllDayERDayRN @maie_lynn @alexsrobin @MSWSHAWN @PharmaKittyCPhT @ImTheMom_TaDa @maryking1948 @writing1977 @hangingoninquie @BrowofJustice @Jemc613 @GongGasGirl @DocPNW @introvertBSNRN @reepRN @thepondinthebox @Mandy_RN13 @drlfarrell @Darn_if_I_know @haydenwwest @coffeeNCalibers @EMdocinabox @SarcasticLatte @Swoopy @Potato_Chip @peggykilty @RedTriage @teenytinydino22 Yup. I'm all for gun control.
1060278018948689920,2018-11-07 14:09:13 MST,brillian_76,"@Hub_Arkush U have good intentions I believe I do 2. u have 2 b able 2 call out BS on both sides 2 move -&gt; Recall, believe all women? Unless they r beaten by @keithellison ? US, innocent until guilty Quit w/ celebs call 4 open borders &amp; gun control while living n gated home w/ armed guards"
1060277605713276928,2018-11-07 14:07:34 MST,gds44,Censorship and Gun Control Will Not Make Us Safe  https://t.co/1OOBILMMBH via @FPPTim
1060277466365747200,2018-11-07 14:07:01 MST,nymanshelley,@ReaganBattalion it's not true .... most Americans want gun control....a small minority do not
1060277391489024000,2018-11-07 14:06:43 MST,garcoak,"@JohnJHarwood @davidfrum I agree with some of this and not all. “Progressive” is a label. Is there a majority in America in favor of health care for all, reasonable gun control, abortion rights and action on climate change? Yup. Why don’t we have that government? 1/2"
1060277104997105664,2018-11-07 14:05:35 MST,larshano,"-hole extraordinaire and yet it was there that Kayne insisted prison reform and gun control and Beyoncé's ""tail"" of others close to the seminar presentation that had ads not withstanding, all were eating kung pao chicken and still George and Damon scarfed sushi rolls fresh."
1060277061435228160,2018-11-07 14:05:25 MST,ilikegamestoo,@BulaBabu2007 @GaryHormell @TeddyFella @PaulMcCartney Utah does have good police though. Fair point. But if the police get demilitarized then they won't have the upper hand when dealing with shooters. @DonutOperator covers shootings and gun control. Watch a few of his vids. Have a good day. Also you didnt press L2 so I won the duel.
1060277005005000704,2018-11-07 14:05:11 MST,rachel_mantell,Been following this race. It’s an interesting one as it looks like gun control and grift were key issues.
1060276961640091648,2018-11-07 14:05:01 MST,yourelovedbeyou,@pfoeller Inside of my body so that makes the baby an extension of my body. Everyone wants to control whether we give birth or not but no one wants to give a shit once it's out. Ya know like taking away the guns that shoot them in school.
1060276939804549121,2018-11-07 14:04:56 MST,__sayitaintso,"@LaurenCalhoun Wait , wasn’t she the one who was saying she valued hospitality workers since the fact majority get look down  upon because of the type of work ?  And I mean gun control is real . Got ppl shooting schools up that are not immagrants (ironic ) lol and..."
1060276764415574018,2018-11-07 14:04:14 MST,phillyfunkradio,"@SueMinister They spend too much time on diversion issues such as Gay rights, Abortion and Gun Control.These are simple issues but they just don't get it. Gay Rights - Love who you want to love. Abortion - It's a woman's choice  and average Joe not have military grade weapons."
1060276663177674756,2018-11-07 14:03:50 MST,galacticmystx,@HaR_ThieF @Eqinxx @Pamaj In that sense YES but using reg guns requires a lot of aim and recoil control especially with smgs
1060276500530774016,2018-11-07 14:03:11 MST,fooonts,"Alguien puso una playlist que tiene a Molotov, Guns and roses, Queen, Control Machete, Metallica y P Mosh. No entiendo cómo se relaciona una cosa con la otra. Llevan casi toda la mañana escuchándola. Y yo con ganas de decirle a quien la puso:  https://t.co/vN6PnFwzWD"
1060276500501430272,2018-11-07 14:03:11 MST,sheilakhani,"@HillaryClinton Dems need to start a grass root education across red district (that they won)about healthcare, importance of affordable education, inclusion, gun control..and most importantly stop fear mongering."
1060276381332910080,2018-11-07 14:02:42 MST,mindyreed21,"Congratulations to Colorado Dem Tom Sullivan, who’s Son Alex was killed in the Aurora Theatre Shooting. Tom has worked long and hard for gun control. He is going to make a great Colorado House Rep!"
1060276339700367362,2018-11-07 14:02:33 MST,patriotnewsn,The 2018 midterm elections may have exposed a shift on gun control  https://t.co/kJHzaw296F
1060275803575980032,2018-11-07 14:00:25 MST,thomash47827295,"@LauraLoomer @MichaelsANewman Here come the Canadians, well sort of Canadians, after that watch for new gun control measures"
1060275718788186117,2018-11-07 14:00:04 MST,ilikegamestoo,"@drum_pounderTN @gregavfc1992 @GaryHormell @TeddyFella @PaulMcCartney If gun control somehow makes it past Congress and AR-15's get banned they can't steal them. So they have to make them, preferably with diamonds. *Epic Joke*"
1060275570137882629,2018-11-07 13:59:29 MST,twiwintereve,"@EvocationzAD It's not that easy though, not legally anyway. Steven Crowder did an episode where he showed some gun control advocates:  https://t.co/sqKx9LWXKG  Worth a watch imo if you want to know the truth about the process of buying a gun."
1060275554149052416,2018-11-07 13:59:25 MST,lanuovasuzy,"So #Washington voters approved criminal justice reform and gun control measures, but voted against gas and beverage taxes??? This is the #SnipSnapSnipSnap of progressivism!"
1060275511811698688,2018-11-07 13:59:15 MST,bri_sacks,The 2018 midterm elections may have exposed a shift on gun control  https://t.co/AYmP3axJId
1060275373873790979,2018-11-07 13:58:42 MST,andreo_micaela,In just a matter of minutes Adam Lanza shot &amp; killed 20 children &amp; 6 adults at Sandy Hook Elementary school. Should gun control be stricter so this event doesn’t occur again or are guns being put in the hands of those who shouldn't have them? #okie1113  https://t.co/iygLTqBkja  https://t.co/u5aAedyCCN
1060275360582041605,2018-11-07 13:58:39 MST,innovateal,"@verge breaks down the midterm election's impact on hot topics in the tech industry: Data privacy, Space Force &amp; Space Policy, Transportation Innovation, Gun Control Research, and Vapes.   https://t.co/y2Qr5d4Qla  https://t.co/n7IdMJX3Up"
1060275284824506369,2018-11-07 13:58:21 MST,democraticluntz,"Like I think last night showed that you're fucked with the rural whites long-term regarding the Democratic party on some combination of abortion, guns and immigration at least absent another serious recession under R control"
