id,created_at,username,tweet
1192588978853052416,2019-11-07 16:45:44 MST,wagepeace,@mathrok @JenD1974 @ewarren This is the same person who said giving Americans single payer healthcare is like giving every American a pony😡 frankly a pony be great help curtail my carbon footprint
1192588953062297600,2019-11-07 16:45:38 MST,trumanburrbank,@EricNezzar @KyleKulinski Was I ever talking about healthcare or UBI? These points still stand. Maybe you should stop jumping to conclusions. I’m only talking about people not having too much power bc humans can’t be entrusted with it &amp; historically always leads to fascism. But I’m the bad guy 🙄
1192588895738834944,2019-11-07 16:45:24 MST,lucybpalermo,"@JYSexton Please. Many of us are terrified she could win the nomination and be a disaster for the general. ‘Free everything’ is how ppl will hear her msg. ‘Trillions, trillions, trillions.’ ‘Taking away my choice of healthcare. I just went thru that.’ Get used to hearing that. 2 extreme."
1192588888742780936,2019-11-07 16:45:22 MST,kdillardrta,"@NorthwesternMed @LurieCancer @AbilityLab @GildasClubCHI @ChicagoGMC The RTA, @cta, @Metra, and @PaceSuburbanBus proudly serve the families, patients and staff of these world class healthcare institutions.  #ShineALight19"
1192588888054874112,2019-11-07 16:45:22 MST,sarahlaverty1,"@10thBnRIR @nmcaree The health service is suffering enormously in England too and significant moves are being made to privatise it. I fear it won’t be left, and as someone with a heart condition that relies on treatment, that’s why healthcare would be top of my list of questions."
1192588882380017664,2019-11-07 16:45:21 MST,somogyianthony,@JudyWoodruff @sangerkatz @IAmAmnaNawaz @NewsHour Thank you for an informative report.. the million more children who have lost healthcare insurance should concern us all.
1192588880203022336,2019-11-07 16:45:20 MST,lngsd,"@SharonJWright1 @peterdaou Depressing to think that Americans would want 4 more years of lying, stealing, dismantling constitution, ignoring laws, sexual assault, greed, injustice no healthcare, white supremacy, fascism, collapse of environment, to avoid going too fast &amp; far in fixing it all. Just saying."
1192588878760288257,2019-11-07 16:45:20 MST,hgetson,5 Ways Machine Learning is Redefining Healthcare.  https://t.co/hmHH7zcEIv  https://t.co/yOh2OIeqkZ
1192588874591027201,2019-11-07 16:45:19 MST,smoffymoth,"@MittRomney That is  totally incorrect. In Australia there are no limits on care, cost sharing or higher middle class taxes. Healthcare is funded by a 2% levy on your taxable income."
1192588862574485504,2019-11-07 16:45:16 MST,briansachs,"@dreacasillasss @AndrewYang Advertising is to increase sales. Nothing more, nothing less.  Banning ads does not prevent patients from learning about new drugs, but it does help decrease the consumerization of the patient and healthcare as a whole."
1192588856002072589,2019-11-07 16:45:15 MST,richardcasey,If only writers and artists for billion dollar companies got healthcare...
1192588849161101313,2019-11-07 16:45:13 MST,supercdn,"@MittRomney Canada has one of the best middle classes in the world, good pay, low taxes plus we have decent universal healthcare. Not one Canadian does without unlike the millions of Americans who go without. Maybe check your stats Mitt."
1192588847940612097,2019-11-07 16:45:13 MST,gerardeff,"@J_WONCHALK @lorge_son @reaIKevin @BernieSanders I think the problem lies in when you get to a point like the Walton family, it’s how you got there. That wasn’t hard work, that was exploitation. They don’t pay livable wages or decent healthcare to those that make them billions and now pay less taxes than them too."
1192588844488486917,2019-11-07 16:45:12 MST,trumpwhispers,"@goodgonegeek @KYLegalnurse In the State of WA, at the age of 13 you have the right to privacy in your healthcare...even from your parents. Choosing to exercise that right is the hard part."
1192588834350829568,2019-11-07 16:45:09 MST,rozietoez,"@millar_marion Necessary trans healthcare, which the NHS is failing to provide adequately, isn't to blame for the NHS' mistreatment of your twins. Both are medical injustice."
1192588828118278144,2019-11-07 16:45:08 MST,anthonygaenzle,Why healthcare practices shouldn't shy away from using social media to market their practice #healthcaremarketing #socialmedia  https://t.co/jacB0hALDF
1192588823357558784,2019-11-07 16:45:07 MST,paradi6mshift,@MittRomney Not having insurance is a limit on healthcare. This argument is disingenuous.
1192588816403632134,2019-11-07 16:45:05 MST,natlawreview,Legislation Re-Introduced to Expand Access to Telehealth Under Medicare  https://t.co/BAPnHDyRRs @SheppardMullin #healthcare
1192588809143234561,2019-11-07 16:45:03 MST,sophiagroup16,"Meet the Trustee - Nicky Nicky's son Ryan was stillborn in 2011.Nicky works tirelessly for our charity.She provides training for healthcare professionals; runs our support group,sends out Angelversary Cards and Recognition of Life Certificates, and manages the charity’s accounts.  https://t.co/4FCVyzrsnK"
1192588805607510017,2019-11-07 16:45:03 MST,clinicoin,Why #groupexercise is so effective: The psychology behind #workingout with others  https://t.co/K6Dw3t0KYD #groupfitness #groupfitnessclasses #groupworkout #healthcare #health #exercise #fitness  https://t.co/CoPDt1XZQB
1192588798758129665,2019-11-07 16:45:01 MST,microsoftteams,"Learn about Virtual Consults in #MicrosoftTeams, a new simple way to schedule and conduct business to consumer consultations, such as healthcare patient consults, client meetings, or job interviews – in private preview. #MSIgnite  https://t.co/ikSy0LNyns  https://t.co/kcmxijs1gO"
1192588797118205952,2019-11-07 16:45:01 MST,sebouh,"Study: Ransomware, Data Breaches at Hospitals tied to Uptick in Fatal Heart Attacks  https://t.co/KywVJQjaIs #Security #Cybersecurity #Healthcare"
1192588785160081408,2019-11-07 16:44:58 MST,vonyugen,@jae_dhi @JonAshworth @woodpecker785 I’ve seen both sides of it. Socialized healthcare is far and away better. The American system of healthcare is failed
1192588764385857536,2019-11-07 16:44:53 MST,jamalisms,@hosienation Money = Healthcare
1192588755468730368,2019-11-07 16:44:51 MST,ellahbie,"@AstroDork2pt0 @DrLearnALot @bourgeoisalien Bernie wants everyone to have healthcare, a living wage &amp; an education. That’s the antithesis of Trump. Hillary was closer to Trump in her views. In the words of Biden, “Come in, man.” 🤦🏻‍♀️"
1192588743992991744,2019-11-07 16:44:48 MST,_amirrad,@CyrusEinfach @jUSTauSEREV ببین مشکل مشخصه: یک درصد برای مدل معاملات و کسب درآمدشون دارن کمتر از تویی که سر کار میری و حقوق می گیری مالیات میدن در صورتی که درآمدشون n برابر توئه و تو حتی با مالیاتی که میدی healthcare درست حسابی نداری آلترناتیو خودت چیه؟
1192588673147125762,2019-11-07 16:44:31 MST,buckperley,"@anguschampion @Mike_Chapman_ I also didn’t say it didn’t work. I explained why the US wouldn’t (or shouldn’t) and why it is ultimately inefficient. The US healthcare system saved my moms life, and as noted above, it would not have been the case anywhere else. So I’m glad we have it."
1192588609221779456,2019-11-07 16:44:16 MST,healthycarnivor,Treatment of Adolescent Obesity in 2020 #HealthCare #obesity #lifestylemedicine #Health via  https://t.co/hmIoXfIspy  https://t.co/1yvdfibWBX
1192588594826956801,2019-11-07 16:44:12 MST,janehalldesign,"@KristineCummins @karolcummins Why can every other country in the developed country has had universal healthcare for decades, and Americans can’t have life saving care"
1192588554305601536,2019-11-07 16:44:03 MST,abnewswire,"Healthcare Information Software Market Is Booming Worldwide | GE Healthcare, Siemens Healthcare, 3M Health, McKesson, Philips Healthcare  https://t.co/DDFlo6upzE"
1192588471963209729,2019-11-07 16:43:43 MST,jcs_hackett,"I told myself I wouldn't tweet about #bbcqt but the BS about what is and isn't devolved has put me over the edge. The *LEGALITY* of drugs is reserved but *drugs policy* also includes aspects of healthcare, policing, &amp;c., which are devolved."
1192588420842962946,2019-11-07 16:43:31 MST,meghanh53303999,"@MittRomney Healthcare in the U.S. is immorally expensive, this is due to the absolute greed of American insurance companies, PERIOD, Americans deserve better, every western country views healthcare as a basic right , until we have government run healthcare, Americans will continue to die!!"
1192588419328659457,2019-11-07 16:43:31 MST,ohsu_chse,Internship Alert! Are you an undergraduate student thinking about a career in healthcare? Apps for the 2020 Summer Equity Research Program @OHSU_CDI are due Dec 20! Come work closely w/ staff @OHSU_CHSE &amp; dive into a health services research project!  https://t.co/FF6UHBFuFV
1192588417391087616,2019-11-07 16:43:30 MST,loveautismdogs,"@0rf @0rf, What you went through sucks, but you know what sucks worse? Not having healthcare. Jimmy has ranted&amp;railed against Bernie for a while,puffing up Tulsi who is not for Medicare for All.  You *know* all the ways Bernie gets attacked, &amp; you just piled on via Jimmy.  Not okay."
1192588416761786368,2019-11-07 16:43:30 MST,theon_orbis,@VodkaMuse @MittRomney I live in one of those countries (australia) and we don’t put limits on healthcare!  Hey @MittRomney don’t you know that lying is a sin?
1192588401880576000,2019-11-07 16:43:26 MST,crucialbits,"""Curogram Closes $1 8M Series Seed Round To Lead Evolution of Two Way Messaging For The Healthcare Industry"" #Startups  https://t.co/IMRTDMOihU"
1192588376035250177,2019-11-07 16:43:20 MST,rvhugs,"Gee, thanks for the info Mitt. We ""make"" our numbers by denying any healthcare to millions, leaving them to die in the streets or at home, leaving them with prolonged disease and pain. Huh? Give me ""socialized medicine."" I don't care what you call it. #ACA #ACA #healthcare"
1192588374281875456,2019-11-07 16:43:20 MST,aecombuildplace,"What perceptions &amp; realities play key roles in shaping the potential social &amp; cultural future of an academic health-science campus? Learn more at #ArchEx2019 about the opportunities &amp; challenges of integrating research, academic &amp; healthcare environments. #aecom_design  https://t.co/cXzbvddEMm"
1192588331126870016,2019-11-07 16:43:10 MST,scottokun,"@RobSchneider Unless you are an illegal alien, in which case you’ll get free housing and healthcare."
1192588317155614725,2019-11-07 16:43:06 MST,clay_c1965,@MittRomney What if the tax raise is lower than the out of pocket healthcare cost for low and middle class?
1192588290211418112,2019-11-07 16:43:00 MST,africaupdates,"@Y7Finance “Since there isn’t enough money to fund these pension and healthcare obligations, there will likely be an ugly battle to determine how much of the gap will be bridged by 1) cutting benefits, 2) raising taxes, and 3) printing money"
1192588279633367040,2019-11-07 16:42:57 MST,jimnewf,@MittRomney Nope. In Canada there is no cost or limits at all and instead of blowing our pay checks on healthcare we pay a more taxes up front. Healthcare here costs half the price as in the US and a larger portion comes from the top percentage.
1192588236008374274,2019-11-07 16:42:47 MST,maxwellbuckner5,"@PeteButtigieg it’s a one way race, keep up the momentum.  @SenWarren can’t promise to not raise taxes to pay for healthcare and more importantly no #democrat is willing to get the #Republican vote.  Don’t worry about #SouthCarolina, you’ll get them and the #centrists."
1192588232980140032,2019-11-07 16:42:46 MST,posttheonion,"@KimSalsman @telekinetica @Robin32459 @SpeakerPelosi @TheDemocrats honestly, I don't get ""independents"" in 2019   one party wants to remove healthcare safeguards ... and one party wants to extend them  one party wants to cut social security (etc) ... the other party protects it  since gop tax cut, it's obviously not about deficit, spending, etc."
1192588221776945153,2019-11-07 16:42:43 MST,pinoys4pete,"""My plan will protect patients by ending surprise billing and capping out-of-network provider rates."" One of my greatest frustrations with healthcare rn. I have no idea how much anything is going to cost and it's never all covered even after deductible. #PeteForPresident"
1192588180534571012,2019-11-07 16:42:34 MST,consulatfravan,@BF_NorthAmerica @EITHealth @BCTradeInvest @franceaucanada @medicalvalley @Pole_Medicen @medicalps @Economie_Gouv @sup_recherche There are 7 competitiveness clusters specializing in medical #biotech in 🇫🇷.  @medicalps &amp; @Pole_Medicen as part of the @EITHealth delegation presented business opps for #BCtech healthcare companies.  #innovationforhealth #ChooseFrance  Get into the market w/ @BF_NorthAmerica  https://t.co/7FQRP1aPjG
1192588179980849152,2019-11-07 16:42:33 MST,victoreeah,@DonaldDees11 @marwilliamson So it's okay with you that your taxes go to serving corporate interests rather than to things like free healthcare?
1192588174658162690,2019-11-07 16:42:32 MST,bioportfolio,Glycotope GmbH Pharmaceuticals Healthcare Deals and Alliances Profile [Report Updated: 13112018] Prices from USD $250: Summary Glycotope GmbH Glycotope is a clinical stage immunooncology company that develops glycobiology products. The company's…  https://t.co/53dKYl9UUi
1192588143532412928,2019-11-07 16:42:25 MST,gratefuldog,"Wait. This happens?  Christ! They're woefully underpaid and overworked, often not even able to afford healthcare insurance from the very hospitals where they work  So the answer is to TAKE AWAY their professional license AND means of income?  How does this make sense to anyone?"
1192588110179250176,2019-11-07 16:42:17 MST,arleniascurls,Special thanks to @Microsoft for inviting me to their first ever Healthcare Envision Forum!  https://t.co/GmvnSj735Y
1192588099672371200,2019-11-07 16:42:14 MST,tejotismos,THIS 👇 I don’t care about your drugs or the infinite side effects that get spewed out. I’ll talk to my doctor if I need healthcare.
1192588088666669056,2019-11-07 16:42:12 MST,factsonrwanda,"@olulion @BusinessDayNg @DavidHundeyin @WorldBank Hello, not as you simply put it.  But it's not just #Nigeria even experts recommend #Rwanda's Healthcare to the #US.   https://t.co/HWzrwfQUiO"
1192588064452943872,2019-11-07 16:42:06 MST,farright2020,"@RepJoeKennedy Why don't you give them free Healthcare, a house, cable TV and let them vote? Oh I forgot, that's what you want to do. I have a cheaper idea, build the f**king wall and deport them. #maga"
1192588059348492288,2019-11-07 16:42:05 MST,workoman,Commercial Manager- Healthcare - ATKINS -  https://t.co/0BxCLEUM2a
1192588051157004289,2019-11-07 16:42:03 MST,cynthiaspaeth,"@MittRomney Hey Mitt: other than kicking millions off ANY healthcare, what is the GOP’s plan? #GOPfrauds"
1192588041422082048,2019-11-07 16:42:00 MST,matterhealth,"""With...MATTER serving as the anchor for early-stage healthtech companies, Chicago has become a very attractive city for new healthcare companies."" Thank you @jsfoundry for the mention!  https://t.co/ndUfNKVuaS"
1192588021301940224,2019-11-07 16:41:56 MST,calamity603,"@BostonGlobe @GlobeOpinion Not only awkward, a big lie about Dems taking away folks healthcare. Painting all Dems with that brush is exactly what TrumpPence will be using to keep a Republican President 😡"
1192588002758995968,2019-11-07 16:41:51 MST,rutkauskasjohn,Best Healthcare in the world? New study outlines the reality of health disparities in the United States. HHS set to reveal new health plan in the coming weeks. Learn more at:  https://t.co/Tp04i4j9d3  #COMM3070  https://t.co/staumGWiLg
1192587985427951618,2019-11-07 16:41:47 MST,mike_mcan,@CNN How about explain her healthcare bill that will cost 2 million people their jobs and raise taxes on everyone
1192587933334691840,2019-11-07 16:41:35 MST,tonkinrichard,"@TheIdesofMark @AaronCheater @pettycommajared You seem to be missing the point. Sure, it’s expensive to make medical advancements, but that cost shouldn’t cost the end user their entire weeks wages. The amazing thing about universal healthcare is that our taxes help buffer that cost."
1192587913772621824,2019-11-07 16:41:30 MST,spaltend,@The_BMC shame on you as a healthcare facility that would allow their professionals to protest flotus. Politics has no place when it comes to bringing light to your cuddle program. Disgrace....to all of us who work hard to save lives....and know politics have no place there!!!
1192587891018534912,2019-11-07 16:41:25 MST,comicsbulletin,@CBCebulski Hiring your writers and artists as full time employees with full benefits like healthcare would be nice instead of continuing to exploit there passion for the medium. Have a nice day!
1192587837297741824,2019-11-07 16:41:12 MST,mahaley15613284,"@YouNicks @ABC @MeghanMcCain The Khans is the best you can do? Please! Americans drive by 50k homeless, Veterans included, everyday in LA who are shooting up drugs, pooping in the streets, no dignity. And yet the Dems want free healthcare for illegals- Am taxpayer funded. Crying 4 the Khans - not."
1192587824794624000,2019-11-07 16:41:09 MST,kimyoun11732107,"@Condordh @nytimes Not any I know , they work at least 2 jobs and pay for healthcare ! The real freeloaders are White Americans , Monroe County Ohio is full of Welfare / Foodstamps upsets !!!!"
1192587823679000584,2019-11-07 16:41:09 MST,humza343,"@MrKebab83 @PeteButtigieg He will lose. If he wins, he continues the status quo which got us trump. No Medicare4all. High premiums. Horrible healthcare. Corporations get away with crap again. 2-4 years GOP blames dem n get control of house/Senate. We get another GOP president. Cycle continues. Don't @ me."
1192587808587886592,2019-11-07 16:41:05 MST,mrindignant,"@Hayward1979 @gorskon @MittRomney So America ranking behind several single-payer healthcare systems as rank by the World Health Organization is not proof? Also you still to show proof of your assertion (also many Americans are traveling to places like Mexico, Canada, Thailand, and China to receive los cost hc)"
1192587806935277569,2019-11-07 16:41:05 MST,lennyservedio,@aaronhuertas You certainly are by saying billionaires should be stripped of their wealth to pay for others healthcare.
1192587796176916481,2019-11-07 16:41:02 MST,hearing4kids,@AdamJanuszewski @FMLM_UK @GeeMcLachlan @LeadersHealth @Simongasman @BMJLeader @bmj_company @BryarsEb @EM_Doc_Caesar @Jingstar @dmlwillis @mountfordjames I very much agree with Adam's summary. You can even replace the healthcare part with education and oncology with primary school and it  is equally holds up. There are lots of similarities between those systems.
1192587773498318849,2019-11-07 16:40:57 MST,daveball77,"@BrianKpunam @tonygoldmark @AOC Moderate implies that a Democrat can win Republican support by catering to some of their desires.  Obama tried that with a healthcare plan that was based on Republican proposals.   If they stuck by Trump praising Putin and trashing veterans, what can a moderate Dem offer them?"
1192587767659859968,2019-11-07 16:40:55 MST,buckperley,"@anguschampion @Mike_Chapman_ Examples I’ve given of how it’s better: cancer survival rate, life saving drugs only available in US, diminishing supply of healthcare workers. feel free to research for yourself, you just asked for reasons."
1192587736848502784,2019-11-07 16:40:48 MST,sp00ni3luv,"@AmySMann @RealClearNews Every penny that goes to shareholders of an insurance company, CEO, or even on marketing is a penny that isn’t spent on healthcare.   Cut out the middleman and the people wasting money on denying your claim, we’d actually save money."
1192587734143193095,2019-11-07 16:40:47 MST,academiamedica,Tencent Healthcare - Como uma empresa de jogos chinesa está mexendo com a medicina e a…  https://t.co/sJpMnrDGb2
1192587727243534337,2019-11-07 16:40:46 MST,najeesho,"@_BetterWithAge I don’t really care how coverage is expanded,  but healthcare definitely shouldn’t be tied to employment. It gives our workplaces too much leverage and control over our lives."
1192587720809304064,2019-11-07 16:40:44 MST,wx_underground,"@MikeBloomberg If you want to protect children’s health, scuttle your absurd vanity campaign and back @ewarren or @SenSanders, whose single-payer platform will ensure all kids have unfettered access to world-class healthcare.   Thanks in advance."
1192587687397490688,2019-11-07 16:40:36 MST,donwross,"@GOP @realDonaldTrump @kimguilfoyle Yes! Because women love being separated from their children, having their healthcare decisions made by the GOP, and having their pu$$y grabbed by perverts like DJT.😂😂😂"
1192587673975656448,2019-11-07 16:40:33 MST,proudam26217245,@SenSchumer Physicians saddled with debt? @AOC saddled with debt? Boo hoo. We need level headed judges the 9th circuit hates America. We have illegals in military housing and veterans on the streets. USCMA voted on yet? Affordable healthcare? Prescriptions
1192587655655108610,2019-11-07 16:40:28 MST,ttefasfgas,"@daviddoel Yes this is the energy we need for the democratic party, old boomer billionaires to tell us that our pathetic slave wages and ridiculous private healthcare system is what's best for this country"
1192587640714989568,2019-11-07 16:40:25 MST,jlspear01,@MittRomney I am tired if you nay saying asshats tellin me “where’s da $’s” when it comes to healthcare and education. MAKE IT FRICKIN HAPPEN! Rents too damn high! Yall got dollas for bombs? Yall got dollas for jail keeps? Take from those mofos... jack-offs...
1192587610511724549,2019-11-07 16:40:18 MST,sebling_,"@Fechtmeyer @teddyschleifer Gates and Bezos (well, Bezos at least) aren't going to allocate $$ to fix healthcare in the US.  I'm Australian. We're all the evidence you need that public health care is affordable. Our extreme right politicians would rather give trigger warnings than reduce public healthcare."
1192587606653054976,2019-11-07 16:40:17 MST,be_kinder2all,@MittRomney What have you got? Do you have a better idea to bring healthcare to the millions of Americans who can't get medical care?
1192587601833795586,2019-11-07 16:40:16 MST,chris_cashton99,"@sepierce @jc365132 @Skippphipps @BernieSanders Well, Taxing and Spending clause says that Congress can tax and spend for the general welfare of the country.  So yes, education and healthcare are perfectly legitimate functions of the government if they choose it to be."
1192587598339796992,2019-11-07 16:40:15 MST,nv_insurance,#Obamacare Open Enrollment - How To Enroll for 2020 ...   A new post has been published on our website.   Read the full article:  https://t.co/Mh4YzAxLqb   #HealthInsurance #HealthInsuranceAgent #Healthcare #LasVegas #Nevada #NevadaHealthLink #OpenEnrollment #Trumpcare  https://t.co/Hc4EFxGAKb
1192587598289502208,2019-11-07 16:40:15 MST,nv_healthinsure,#Obamacare Open Enrollment - How To Enroll for 2020 ...   A new post has been published on our website.   Read the full article:  https://t.co/IH44ZDJVju   #HealthInsurance #HealthInsuranceAgent #Healthcare #LasVegas #Nevada #NevadaHealthLink #OpenEnrollment #Trumpcare  https://t.co/3YOuezooZN
1192587570913435649,2019-11-07 16:40:08 MST,lacefire7,"Goodnight #Resistance: you keep me sane.🌊🇺🇸🏳️‍🌈🇨🇦🇬🇧🌎🗽🌊Equality4all, separation of church and state, end citizens united, healthcare not scarecare, No to big pharma. Climate and Gun control. Defend the constitution impeach  malignant narcissist &amp; enablers."
1192587570288439301,2019-11-07 16:40:08 MST,modestgroup,"Do you need healthcare? If so, open enrollment is happening right now!!! Visit  https://t.co/vLPk87oQUL and sign up for health insurance today!  https://t.co/KdWnk3bKKe"
1192587559257423872,2019-11-07 16:40:05 MST,novascripts,#Healthcare and #Pharma being able to reach neighborhoods and communities that are like deserts for both is the most important hurdle we work to overcome. The #health of the country relies on organizations like us doing our jobs. #ThursdayThoughts
1192587536968892418,2019-11-07 16:40:00 MST,trainingmindful,“How Mindfulness Meditation Is Transforming Our Society”  https://t.co/rC5y8ju29Q #healthy #meditation #healthcare wellness
1192587519084441600,2019-11-07 16:39:56 MST,fallenpoultry,"@steve68116540 @cuckadoodleshoo @Marmel @ClintonFdn @CWTips or at least have their overall mission statement revised. its a noble goal trying to provide free/low cost healthcare to women, but i also think it would be more effective to try to push preventative measure vs reactionary measures. on the flip side, we do need to acknowledge"
1192587505431961601,2019-11-07 16:39:53 MST,kennedyk24,"@bigep13 @JerseyFinFan @MarinelliShane Help the poor in communities around the country. Education will still suffer, healthcare and infrastructure. Yes bill is a great guy and he'll still be an affluent great guy. He'll still be worth more than anyone else."
1192587473978830854,2019-11-07 16:39:45 MST,annsinead,Today's #3GoodThings 1. @HarkinDeirdre  2. @natalie_hegarty  3. @raineymac2  Fabulous to spend time with these trailblazing healthcare researchers in The Town I Love So Well #circleofdocs #docsinthecity
1192587419050299392,2019-11-07 16:39:32 MST,ctman1,"@0myrealname0 @GiverGoddess88 @KyleLovesBernie @ewarren @BernieSanders A progressive tax will pay for #MedicareForAll. Not a regressive right wing dream of a flat tax, which would be about as dumb as an alleged lefty using a bill written by the Heritage Foundation to “fix” healthcare."
