id,created_at,username,tweet
1192581461922197509,2019-11-07 16:15:52 MST,ste_meehan,@sammywrainbow @Philosophi_Cat @jeremycorbyn They don't have to pay for GP or A&amp;E services I believe but would have to pay for some hospital care so immigration no doubt adds a lot of pressure to those doing a fantastic job for us under very difficult circumstances.
1192581388488171520,2019-11-07 16:15:34 MST,derangedradio,Home Secretary Priti Patel to announce new points-based immigration system after Brexit   https://t.co/cD37aKq7M6  https://t.co/LOkM2nfLS0
1192581368582029312,2019-11-07 16:15:30 MST,azfrw,"Sanders' immigration plan: Halt deportations, abolish ICE, welcome 50K 'climate migrants,' give welfare to all   https://t.co/ncQ4qNaAPK"
1192581358146785281,2019-11-07 16:15:27 MST,kalehman492,"Forget about our immigration crisis? It's still there, and it's growing.  https://t.co/HFETFQWQr9"
1192581333106798592,2019-11-07 16:15:21 MST,aiiamericangiri,Minnesota Town Hikes Taxes as Mass Immigration Overwhelms Schools  https://t.co/HjCBKD1XO5 @BreitbartNews #AAG #AAG2020
1192581275636420608,2019-11-07 16:15:07 MST,lumserve,Professional &amp; skilled immigrant workers are a valuable resource to our community. The presence of the LUM Immigration Clinic sends a message that Greater Lafayette is a welcoming community and values the contributions of immigrants and their families. #lumportofhope  https://t.co/554S6WgFk7
1192581263875555328,2019-11-07 16:15:05 MST,ladailyjournal,.@UCILaw students win 9th Circuit immigration appeal   https://t.co/v2o5dG43t7  https://t.co/mLVQTwmdAp
1192581259207282689,2019-11-07 16:15:03 MST,stonewall1117,@momma_bees @AnnCoulter I'm not an expert on the legal immigration path but I know enough about it to know it costs a lot in terms of money and time. There is an American-civics test. I believe there is a English speaking requirement. One would reason that it is a lot to go through for someone who....
1192581254274830336,2019-11-07 16:15:02 MST,sdworkforce,New federal #immigrant integration bill includes NSC-recommended #workforce and #education components:  https://t.co/rKlGz1TVbJ @AmandaWorking @SkillsCoalition #thisisworkforce #immigration  https://t.co/WP1vAuTgUZ
1192581224616869889,2019-11-07 16:14:55 MST,stvitusdance,@DavidLammy How about finding them and deporting?  There's an empty immigration removal centre in my town ....
1192581213309063168,2019-11-07 16:14:52 MST,christianslaw,"The @USDOL recently implemented FLAG, a digital technology to modernize application experiences. The H-2A temporary agricultural program, is now available on FLAG. Read more here:  https://t.co/1lKEia2jVl #DepartmentofLabor #H2AVisa #visas #Immigration #employers #agriculture  https://t.co/cOd2npmA9M"
1192581199388131329,2019-11-07 16:14:49 MST,emilie_ni,"About to go live on @PnPCBC to discuss @francoislegault  and @SJB_CAQ’s immigration reform, along with @dthibeaultSRC. #polqc #canpoli"
1192581196439416833,2019-11-07 16:14:48 MST,arjunhardas,@DrAyeshaRay Try lying on a visa application to the US and see how entertaining the immigration authorities will be to you.
1192581186926895104,2019-11-07 16:14:46 MST,pkjaimitmonnom,"@Al_Muhazine Ça rend pas la chose plus morale, je trouve ça tlm dégueulasse. C'est une insulte aux intellectuels de pleins de domaine, l'immigration c'est pas juste pour combler des postes à court terme, la diversité intellectuelle c'est essentiel, c'est con de refuser des doctorants et tt"
1192581126545645577,2019-11-07 16:14:32 MST,martin07957671,@BBCQTComments Indian immigrants fighting to split Scotland from the United Kingdom. How bloody odd has our country become. Immigration is destroying our country not enhancing it.
1192581112440209409,2019-11-07 16:14:28 MST,darrendreamin,@GRALambo @gatley_shaun @ZzBeard87 @TiceRichard And how will leaving the EU change immigration policy? Most immigrants to this country only want to work and better their lives
1192581101451001856,2019-11-07 16:14:26 MST,gwlarson2002,Bernie Just Dropped His Immigration Plan: Abolish ICE and Make DACA Recipients Legal - VICE  https://t.co/UCGcrGn5k6
1192580955405459459,2019-11-07 16:13:51 MST,leavehq,You can tell who doesn't have a two hour morning commute through gridlocked traffic by their attitude to illegal immigration amnesties.
1192580827525373952,2019-11-07 16:13:21 MST,tweetie11609558,Sheriff Who Frees Illegal Alien Convicted of Child Sex Crimes Says Enforcing Immigration Law Not Part of His Duties | Judicial Watch  https://t.co/QH7zGpzDB1
1192580818155245573,2019-11-07 16:13:18 MST,shotsmanic,"@MigrationWatch High levels of immigration since 1979 has distorted Govts `value for money` test on beloved outsourcing. Low skilled catering, cleaning contracts are bid and won at ludicrously low price with Govts full assistance with tax credits and other benefits."
1192580797460615168,2019-11-07 16:13:13 MST,mal1976retaf,@ScroogeMcgruel @dianne1h @lisakitchens8 @cjTNVol @_edwardmondini_ @verfolg @GelicaAF @WeidnerRoger @us_poll @meaculpau27 @Galaxy8SGQ @GilbertLane14 @LadyChesapeake @TheAkmed @HarrietNix @Adorable_Todd @tehipisehaka @DavidSm54770948 @GiboneyDavid @SaundraSmoss @AzDerbyGirl @hogansgoat2423 @howienudet @Marilyn122868 @TammyChabot @Sarahrain19 @DoyleCarroll678 @real_vt16 @rfragan @irishgirl17th @Sig_Rasmussen @Nick30664336 @WaydeDe @WhatAboutBob7 @FeharlanFrank @GiacomoCeraolo @Mnms0606 @warrenwarmachi1 @Rabbit70414459 @ReidSingletary @NGirrard @1foreverseeking @Desert_Crow @24windchimes @ASauer65 @veteran423 @Paul_USAPatriot @StevieOakley @rob_omgwtf @wchs8fox11 Many just give up. I have been fighting this along with various anti-illegal immigration groups as ALIPAC &amp; Numbers USA since 2006. Lots of writing &amp; calling through the years but the fact we have been able to stave off all attempts at amnesties made all those efforts worth it.
1192580786085515265,2019-11-07 16:13:11 MST,bearhillcree,Does not matter which Government puppets are in. Genocide is still alive and well in KKKANADA. Be nice IF I could deport some Racist people as an Immigration Official.
1192580782524641283,2019-11-07 16:13:10 MST,timmcghee,#HouseHearing: Immigration Raids: Impacts and Aftermath on Mississippi Communities  https://t.co/GjMdMOAZ2D
1192580744633339906,2019-11-07 16:13:01 MST,democracynow,Immigration Activist Marco Saavedra Heads to Final Asylum Hearing  https://t.co/wqOyRqtDup
1192580640379555840,2019-11-07 16:12:36 MST,rickrake,"Great meeting with Kevin Tatla today, immigration specialist with our former MP in Mission, who has decided to stay on with the Mission Local Immigration Partnership to share his knowledge with the team and work on a specific project. #Missionbc  https://t.co/mfdrC7lPqX"
1192580629558374400,2019-11-07 16:12:33 MST,stregaemp,The world knows  Venezuela.  Tony Blair used the UK as a social experiment on immigration to use taxpayers money to bail out banks as well as pay the salaries of the top companies workers by introducing working and child tax credits far rather than fine them and make THEM pay
1192580556275560448,2019-11-07 16:12:16 MST,pinokole,"@Rhl15738352 @ICEgov @NIACouncil @SenatorDurbin Okay, you claim to be ""voice of immigration"", yet your only goal is to fight other immigrants. Everyone has already known that it's a lie that IV speaks for immigrants. It only speaks for big business. #S386"
1192580520812482562,2019-11-07 16:12:07 MST,stevepratico,"@paulmac708 Paul, I'll not pretend to know the sentiments on-the-ground in the UK  However, I have been watching from afar and it seems like you have a cultural/immigration problem that is affecting many aspects of your country/culture.  Don't you think 'leaving' would give you more options?"
1192580469705125893,2019-11-07 16:11:55 MST,swisskrono_jh,@Fizz978 @StephenFarryMLA @allianceparty You’re seeing democracy at work. It didn’t just end with a binary advisory referendum. Leave knew this that’s why they deliberately fought the referendum on NHS and immigration which had nothing to do with EU membership. When you lie it comes back to bite you.
1192580458183159808,2019-11-07 16:11:52 MST,patriceroytj,"#LePanel  Immigration: François Legault défend sa réforme  «C’est un peu dommage de voir M. Legault utiliser des arguments qui sont vraiment passés dus. Le patronat qui veut du ""cheap labor"", on n’est pas à New York en 1920.» - @MCAuger  #polqc #assnat  https://t.co/NVcl1StZfC"
1192580410506694656,2019-11-07 16:11:41 MST,jaygaudinier,"@SenFeinstein Hundreds of thousands of Illegal immigrants children were illegally brought to America by Illegal immigrant parents trying to avoid Immigration laws! Don't look for sympathy Dianne, these same immigrants COULD have come in LEGALLY. They chose not to."
1192580399781814275,2019-11-07 16:11:39 MST,thedobster69,Labour to scrap controls on immigration and hand foreign nationals the right to vote' | via @telegraph  https://t.co/xnqw3incZ2 this is why labour should never come to power 😡😡😡
1192580381918121985,2019-11-07 16:11:34 MST,immigration_biz,#AsylumWorkPermits  Opposition Mounts to Trump’s Effort to Delay Work Permits for People Seeking Asylum. The proposed rule risks leaving people unable to support themselves and their families for months.    https://t.co/VYDHs4pm5u
1192580376025161729,2019-11-07 16:11:33 MST,hannahnaylor11,"@gubbe_gubbe I love that! As simple as it sounds, it's so important to be able to see others, even those we don't know, as human beings, too. How do you feel about the quality of conversation on immigration in the US right now?"
1192580358874771456,2019-11-07 16:11:29 MST,tomjackson10,@damianburns All about connection/immigration in Ireland.
1192580344760995840,2019-11-07 16:11:25 MST,epkaufm,"It was a pleasure meeting @nytdavidbrooks during stimulating discussions in France, and nice nod to Whiteshift ( https://t.co/hPySFXk8Ip) in his new column on immigration and solidarity in western countries  https://t.co/VHfJmjhJWW"
1192580288297275395,2019-11-07 16:11:12 MST,joltaction,"""It's heartening to see Sen. @BernieSanders release an immigration plan that rejects the hateful rhetoric of the current administration and instead focuses on a solution for the 11 million immigrants living in limbo in the United States."" - @AntonioArellano  https://t.co/HgmDUOQBat"
1192580250351235072,2019-11-07 16:11:03 MST,larrynak,#BBC 🇬🇧Quebec denies French student's immigration over English thesis chapter  https://t.co/krl7MBP7Og (2019-11-07 22:48:29Z)
1192580246073171973,2019-11-07 16:11:02 MST,somebodyowens,"@seascrib3 I love my job a lot! And unfortunately, leaving here would mean a complete career change and likely some sort of schooling to make that happen.  Part of today's angst is that for immigration reasons, I need to show consistent work and stable finances."
1192580236921253888,2019-11-07 16:11:00 MST,la_crystal,"Bernie Sanders' immigration plan would put moratorium on deportations, end ICE raids - CNNPolitics  https://t.co/w2y3XmfQLC"
1192580166326931461,2019-11-07 16:10:43 MST,randsomfn,@Willy_974 Normal la violence est la conséquence de l'immigration
1192580162170368000,2019-11-07 16:10:42 MST,3ty3,"Bernie Sanders was the preferred candidate in every policy category, which included ""immigration,"" ""health care,"" ""the environment"" and ""the economy and jobs.""  https://t.co/iBhEFxcb1p #BernieSanders2020"
1192580155367145472,2019-11-07 16:10:40 MST,judyswettjudy,Congress has the power to #DefundHate and stop the funding of Trump's horrible immigration policies. SIGN @MOMSRISING'S LETTER NOW!  https://t.co/EaqDh04a5S
1192580121863081984,2019-11-07 16:10:32 MST,boblister_poole,Labour to scrap controls on immigration and hand foreign nationals the right to vote'. Here Are More Reasons Not To Vote For Corbyn!| via @telegraph  https://t.co/3NjrGPAlGm
1192580101977841664,2019-11-07 16:10:28 MST,kaplanben_fr,Sondage : 73 % des Français ont une mauvaise opinion de la politique du gouvernement en matière d'immigration...  https://t.co/HSQ6dtrls0  https://t.co/4E2n1NtgLw
1192580092691566592,2019-11-07 16:10:25 MST,jguydon,"Dont forget about the deportation and immigration policy,they wana blame trump for that too.."
1192580044561928192,2019-11-07 16:10:14 MST,torrhl,"""Today, immigration is increasingly suburban.   As of 2010, 51% of all immigrants resided in the suburbs.  Today’s suburban immigrants are also more highly educated than those of the past.   One reason they choose suburbs is for access to their schools.""   https://t.co/mO2UDuLXaI"
1192579979332194305,2019-11-07 16:09:58 MST,earthsindie,"""US immigration | US news | The Guardian""  https://t.co/RRM1J51lSS"
1192579884666802178,2019-11-07 16:09:36 MST,jennbetaqueen,@NydiaVelazquez Thank you so much. This is why we need Bernie's new immigration plan!!
1192579870322069504,2019-11-07 16:09:32 MST,ky_perbole,"Donating a small amount to show my support of the new immigration plan. #AbolishICE #Bernie2020 #NotMeUs   If we are going to defeat Trump and transform our country, it will take all of us.  https://t.co/M4wZlJUbXS"
1192579851145895937,2019-11-07 16:09:28 MST,jmussuto,Opposition Mounts to Trump’s Effort to Delay Work Permits for People Seeking Asylum I things just  https://t.co/lP5fWuYhvK #immigration #feedly
1192579805239283712,2019-11-07 16:09:17 MST,bigleaguepol,"Dan Crenshaw Betrays Constituents, Comes Out in Favor of Mass Immigration and Demographic Shift  https://t.co/EaEEEbOvnw"
1192579794216640512,2019-11-07 16:09:14 MST,kaposucio,We got the slow Jams to! “Come Over” @AkSucio and myself 😈 LINK IN BIO #SucioMobb   #immigration  #EOS #latinos #OTM #music #rap #hiphop #upcomingartist #trap #atlanta #rhodeisland #texas #california #hispanic…  https://t.co/FEVUsUYw8b
1192579783919464449,2019-11-07 16:09:12 MST,leftistwastelnd,"France gets it. If you open the floodgates to immigration, legal or otherwise, and just allow people to come in unfettered, in the end it creates colossal problems.  Democrats know this, but colossal problems don't impact them. They just want votes.  https://t.co/cD7xGubmW1"
1192579772464939008,2019-11-07 16:09:09 MST,minbrown2002,Her assessment was very racist and shows that the right fears immigration and diversity.  #HoldHerAccountable #WhatTriggersConservatives  https://t.co/TrNAhcePV6
1192579740634402818,2019-11-07 16:09:01 MST,realise_innov8,"@BBCNewsnight @BBCTwo @IanAustinMP @KirstyWark October 2014 + again in December 2016 @IanAustin1965 called for greater action to LIMIT immigration; he proposed a range of measures to achieve this: tighter border controls, fingerprinting immigrants, reducing benefits entitlement, charging foreigners for NHS care #racist #fraud"
1192579723999756288,2019-11-07 16:08:57 MST,immattybanias,Fourth Circuit schedules Adam Walsh Act case for oral argument in January 2020. #AWA #litigation #Immigration Anyone looking to Amicus this issue?
1192579611844059139,2019-11-07 16:08:31 MST,nyebev4eva,@BBCr4today @bbcnickrobinson Ian Austin has got form. He tried to oust and smear Ed Miliband too. Now he's telling Labour supporters to vote Tory. He was one of those wanting Labour to take an anti-immigration stance. He was against investigations into the Iraq war. Let's be aware of who we're dealing with.  https://t.co/07ZTX1adcQ
1192579604394868736,2019-11-07 16:08:29 MST,jsmolenski,"@smr2red No, not all by any means. But one of the things that is striking about the boomer generation, if you stick to the general cut off of 1965 is that it's right when the US changed its immigration policies. Older boomers, certainly, were moving into adulthood before this change hit."
1192579578566459392,2019-11-07 16:08:23 MST,franckladouceur,vous voulez savoir ce que je pense de l'immigration?
1192579559033585664,2019-11-07 16:08:18 MST,jarais,"Bernie’s immigration platform, y’all 😍😍😍"
1192579535432232960,2019-11-07 16:08:12 MST,elsie_duckworth,"@MillyHanvey @EssexPR And Farage can be trusted ?! He’s bankrolled by the banking elite, he’s used immigration as a means of fearmongering. Fortunately he’s got zero chance of any democratic power."
1192579509851172864,2019-11-07 16:08:06 MST,kilby_keith,illegal immigration News &amp; Discussions  https://t.co/w3wDE5LDug
1192579474035863553,2019-11-07 16:07:58 MST,bethandcats,"@probably_hungry I do know there's some immigration in my biological history but I don't know when or where, I believe my great grandparents. I know there's Jewish and Swedish and Dutch in my line. I'm learning. But not the concrete details I want.  You SHOULD record them, that's great history!"
1192579423700226048,2019-11-07 16:07:46 MST,ronl1946,California bans private prisons and immigration detention centers  https://t.co/VQWX1zL4kP
1192579368087773184,2019-11-07 16:07:33 MST,covensure,Quebec denies French student's immigration over English thesis chapter  https://t.co/DQV2L1nDg3  https://t.co/HURd0s3tuO
1192579368008089600,2019-11-07 16:07:33 MST,cahulaan,"Bernie Sanders releases detailed immigration plan, including vow to 'break up ICE and CBP': Sen. Bernie Sanders has released a bold and detailed immigration plan that pledges to protect millions of families…  https://t.co/iHq8V1ma2R #25thAmendmentNow #ImpeachTrump #TheResistance  https://t.co/91VwwF6YCs"
1192579349427478528,2019-11-07 16:07:28 MST,redheartaz,California bans private prisons and immigration detention centers  https://t.co/sPVIEUH6az
1192579347925929984,2019-11-07 16:07:28 MST,jondknight,Quebec denies French citizen's immigration application because chapter of thesis was in English | CBC News  https://t.co/9vnAWE6DIQ
1192579306200977408,2019-11-07 16:07:18 MST,v_prz_re,Réaction normale de la population face à la politique désastreuse du #gouvernement en terme d' #immigration .
1192579302883069952,2019-11-07 16:07:17 MST,cryptonomous9,@Mickeybook14 @Garossino Sorry that you hate the way democracy works. I hear the Sudan is accepting immigration applications.
1192579281551069184,2019-11-07 16:07:12 MST,z_arathoustra,"@jvoudeteste Comment ont fait les différents vagues d’immigration ? (Italie, Portugal etc..)"
1192579270738096129,2019-11-07 16:07:09 MST,pinokole,"@Rhl15738352 @ICEgov Have temples, but don't call yourselves representatives of all immigrants or voice of immigration. You are only voice of Hinduism. That is the lie. #S386"
1192579245601509376,2019-11-07 16:07:03 MST,back_dafucup,@mdcfBBA Oh. Big time. They went in there dressed to scare people as well leading them to believe it was an immigration raid. Bastards.
1192579241759645696,2019-11-07 16:07:02 MST,davtoussaint,"@Jacquiecharles @Cormierplage @Delta It will be great to inform people they are closing their field office in several  other countries. A decision that has nothing to do with the current situation in Haiti, but everything to do with the immigration reform that’s currently happening in the US"
1192579221870137344,2019-11-07 16:06:58 MST,marcgra95162166,"@simonbohn Giving an amnesty makes the statement that you don’t have to apply to immigrate, all you have to do is get there and they give it to you anyway. The idea is madness, it is showing to the world the open back door to immigration."
1192579216350433280,2019-11-07 16:06:56 MST,dgp_liberty,"Who wonders why a lone judge in California speaks for the entire nation with respect to immigration?  Why it’s always courts in Hawaii, California, New York?  Why higher courts so frequently overrule?"
1192579207651627009,2019-11-07 16:06:54 MST,spenglerio,"@GillesClavreul Tant que nous conservons le plus grand taux de croissance de l'immigration, la colonisation de peuplement demeure notre horizon."
1192579198671560705,2019-11-07 16:06:52 MST,drbufka,Can Any Doctor Ethically Work In A U.S. Immigration Detention Facility? via @forbes  https://t.co/pEkBMdWAed @drvailewright @drmaryalvord @drsharonbober
1192579112587661312,2019-11-07 16:06:32 MST,yellowd33146486,"@MxdUpShookUpGrl @existensil @aidachavez @mehdirhasan I’ve read your articles, mostly opinions no facts. Trump only wnforeced laws on books that Obama let fall aside the road. People voted for Trump because of problems with lax immigration policy. He is doing what voters wanted. Fulfilling promises."
1192579105436381184,2019-11-07 16:06:30 MST,mila70943219,"Immigration : qu&amp;#039;est-ce que la PUMa, cette aide médicale aux demandeurs d&amp;#039;asile qui coûte plus cher que l&amp;#039;AME ?  https://t.co/9P7TE1g8yf"
1192579088038465536,2019-11-07 16:06:26 MST,maninmiddle2020,"'Around the Table': Sen. Amy Klobuchar talks immigration, health care, gun control and her path forward with NH voters - ABC News -  via @ABC  https://t.co/a1RT3bWGrs"
1192579062197342208,2019-11-07 16:06:20 MST,christy56074523,"Sanders' immigration plan: Halt deportations, abolish ICE, welcome 50K 'climate migrants,' give welfare to all | Fox News  https://t.co/n93CfPdOwg"
1192579048758747141,2019-11-07 16:06:16 MST,becbecss,@kasia_potoniec up immigration enforcement 😍😍 i’m calling them now
1192579016651206656,2019-11-07 16:06:09 MST,kingspirazion,BBC News - Quebec denies French student's immigration over English thesis chapter  https://t.co/rgWq2EkZde
1192578965782839303,2019-11-07 16:05:57 MST,bikerboots,"@ajc If you like what illegal immigration is doing to the black community, vote Democrat. ""Illegal immigration to the United States...[depressed] both wages &amp; employment rates for low-skilled American citizens, a disproportionate number of whom are black men.""  https://t.co/5bzr80KRbo"
1192578928839479297,2019-11-07 16:05:48 MST,justjim00001,@SenSchumer Let me know when you're going to stand up for our nations immigration laws. Hypocrite
1192578927744704512,2019-11-07 16:05:48 MST,commerceof76,"RT ACLU 📲We're holding an Instagram Story Q&amp;A with one of our immigration policy experts, MadhuGrewal!  If you have questions about DHSgov — the key tool used by the Trump administration to terrorize immigrants — reply to this tweet or send us a response here➡️ …"
1192578921017085953,2019-11-07 16:05:46 MST,dominikrockon,"""Plus y a de main-d'oeuvre au Québec, plus on peut garder les salaires bas"" - François Legault DU CHEAP LABOUR!!! @francoislegault c'est ça, ton affaire d'immigration, attirer du cheap labour pour les entreprises. Crisse d'hostie, c'est pas une business, c'est un pays! #polqc"
1192578920215801857,2019-11-07 16:05:46 MST,itzame4jc,"@Dawn29_dawn @sabine_durden @POTUS @realDonaldTrump AND literally selling their kids!!!😡🤬 Not all but ONE is too many! COME HERE THE RIGHT WAY!!! WE LOVE LEGAL IMMIGRATION, ITS MADE OUR GREAT COUNTRY BETTER!👍🇺🇸🇺🇸🇺🇸💯❗"
1192578904281796608,2019-11-07 16:05:42 MST,series_icon,Quebec denies French student’s immigration over English thesis chapter  https://t.co/gljL8jcI0J
1192578891128483840,2019-11-07 16:05:39 MST,mycitynewsca,Quebec denies French student’s immigration over English thesis chapter  https://t.co/lPQXbIDShy  https://t.co/2sYv3wD74H
1192578888196665344,2019-11-07 16:05:38 MST,urbanagami,"So exciting to unveil this placemaking project at Monroe &amp; Idlewild today. Thank you to MoRA, Charlotte Water, Housing &amp; Neighborhood Services, Office of Equity Mobility and Immigration, and our brilliant local artists of OBRA collective! District 5 public art!  https://t.co/aWaxVsHxXQ"
1192578807640707073,2019-11-07 16:05:19 MST,probably_hungry,"@BethandCats My dad's mom was adopted and his dad was an abusive alcoholic, so we know very very little from his side. 😔  I need to have my maternal grandma tell some of the immigration stories from her side and record them for posterity. I wouldn't do them justice."
1192578787965390848,2019-11-07 16:05:14 MST,kha_yaz,"Top story: Quotas d'immigration : une mesure d'enfumage extrême plutôt que d'extrême droite  https://t.co/FTx5mj3Ik9, see more  https://t.co/sfRoSOyhJ0"
1192578742016712704,2019-11-07 16:05:03 MST,ucsandiego,"With the relations between Mexico and the U.S. becoming increasingly difficult to navigate, @USMEXUCSD at @GPS_UCSD is expanding its research agenda and creating new roles focused on security and immigration.  https://t.co/vSrSQQky0d  https://t.co/zoFCp0HBi6"
1192578697678786571,2019-11-07 16:04:53 MST,naijamoon_,Quebec denies French student’s immigration over English thesis chapter  https://t.co/l8dVe4XtU5  https://t.co/zcDLUSmKyl
1192578660911452161,2019-11-07 16:04:44 MST,tadmura,"Ouverture de nouveaux CRA, réduction de la couverture santé... : la France serre la vis question immigration  https://t.co/iiqwqwk9eo via @InfoMigrants_fr"
1192578652766134277,2019-11-07 16:04:42 MST,_flaquita96,Me to the kids: So what do y’all want for Christmas  One of the little boys: I just want my dad to get out of the immigration center  Me:  https://t.co/bmZnRsLhmy
1192578584059293699,2019-11-07 16:04:26 MST,maghaiti,Le bureau de services d’immigration pour résidant américain USCIS des États-Unis en Haïti fermé  https://t.co/ZGFLO0L8wC
1192578532897107968,2019-11-07 16:04:13 MST,borderstoriesaz,"At immigration policy’s core, “It is a question of identity, it is a question of culture,” she says. She says that she believes that many people do not change their minds substantially on policy."
1192578498340249600,2019-11-07 16:04:05 MST,garciawiz,"Bernie Sanders vows to halt immigration raids, deportations if elected president  https://t.co/bBZ2LQ0l17"
1192578429545308160,2019-11-07 16:03:49 MST,orlaocalla,@zumragur Guys clearly the immigration officers have taken her phone
1192578421311889408,2019-11-07 16:03:47 MST,dorisbcc,"Sanders' immigration plan: Halt deportations, abolish ICE, welcome 50K 'climate migrants,' give welfare to all  https://t.co/EjQUiTJkMW"
