id,created_at,username,tweet
1192589428318973952,2019-11-07 16:47:31 MST,scchapman63,Opinion | How to Beat Trump on Immigration  https://t.co/nVB3jQDzSc
1192589319866920961,2019-11-07 16:47:05 MST,weeshug72,@LornaFinn Another lack of an immigration barney when it comes to Scotland.  #bbcqt got it yet BBC?
1192589307367739392,2019-11-07 16:47:02 MST,lgliddon,"@SenFeinstein Why didn't you Democrats make a Comprehensive Immigration Deal with Trump?  The Dreamers future could be secured right now, but you put partisan politics ahead of good people.  Please retire.  You do not serve our state well."
1192589160596545539,2019-11-07 16:46:27 MST,coloradobrt,"Thanks @SenCoryGardner Honored to support your #bipartisan work on #Immigration You and @SenatorBennet have been outstanding leaders on comprehensive, pragmatic reforms"
1192589142905040896,2019-11-07 16:46:23 MST,acspollen,Also the stupidity and laziness of those embracing the failed ideology. Immigration and College Debt Make America Vulnerable to Socialism  https://t.co/l1igLiIyfj
1192589139759239168,2019-11-07 16:46:22 MST,petit_gaulois,"@sebastienmagro @PJouanneau alors qu'il aurait ne fuse que dû en voter une : limitation de l'immigration à 10/20000 max par an, de manière choisie en fonction des compétence et pour éviter les problèmes d'assimilations ou autre. voilà ce qui aurait dû être voté."
1192589091407306752,2019-11-07 16:46:11 MST,falconoticias,Bernie Just Dropped His Immigration Plan: Abolish ICE and Make DACA Recipients Legal — The Sanders immigration plan is a progressive policy wish list that includes pausing deportations. via /r/politics  https://t.co/QszJhpcSoC
1192589069739593728,2019-11-07 16:46:06 MST,ap_corpcomm,".@AP, @frontlinepbs documentary, out on Nov. 12, to examine mass detention of migrant kids, immigration policy under Trump. Watch the trailer:  https://t.co/NGe63hlKtI"
1192589050324176897,2019-11-07 16:46:01 MST,pivottwistdev,"It's Groupon for immigration, but with Blockchain technology!"
1192589045794267138,2019-11-07 16:46:00 MST,lmunito,U.S. Senator Bill Nelson speaks on the country's immigration crisis  https://t.co/1jJuNOkG4s via @YouTube
1192589034603892736,2019-11-07 16:45:57 MST,duks44,"Scotland make no mistake a lot of BRITS detest SNP &amp; STURGEON, she plays stupid games,under EU which is near collapse huge debt, stupid immigration &amp; is a dictatorship. WE WILL BUILD A WALL. SNP are juvenile, pandering to a fake future. BRIT WORK will be Ireland, Wales, England"
1192588970338770945,2019-11-07 16:45:42 MST,icanplainlysee,"@Schanette55 @ShilohStarrs @COL314 @bmickeydanger @Whiskey100Proof @atlantis000000 @melissacali @Big_crusher1000 @GracieLovesUSA @ezvic420 @RoknSpock @marvin_hill123 @WhimsicalMeToo @teddymac1958 @toddbob1 @bodysouls @Consofcooking1 @RalphS24381648 @Angel1350852961 @GJohnston2014 @DogloverMmat65 @raelela @__CassidyRae__ @seniorveteran @davidf4444 @HarryMi47749146 @TChris67 @NickJb1986 @watchit00 @establishmentno @laneylane25 @OGCliffhanger @WagonKnoggin @ritageo52 @RobertMabr @adagioforstring @mynropmail @WattzzD @traveler002 @12Bravo20Dave @yariv72341727 @Quin4Trump @Brialalexi @JebBush @MicrosoftPSNS @SQLServer @Microsoft_Gov @OversightGov @ODNIgov @FBI Chelsea will soon be running for a NY House seat.  She'll be an avid proponent of the Climate Swindle, abortion on demand, Social Justice bigotry, illegal  immigration, anti military and anti cop, and every other radical Leftist orthodoxy.  She's not a child any longer."
1192588950994587650,2019-11-07 16:45:37 MST,keineafd2021,@WELTnews Immigration
1192588949795037184,2019-11-07 16:45:37 MST,us7thcircuitct,Ramos v. Barr #Immigration  https://t.co/KDjFrOnGEz
1192588919260495873,2019-11-07 16:45:30 MST,therecksays,@EmeraldRobinson Illegal immigration has been declining since 2000 but you just continue being racist.
1192588914617454592,2019-11-07 16:45:29 MST,nesbot_ot,"Non-Voting Democrats are more likely to think white discrimination is a problem, oppose immigration, but they do like single payer.  https://t.co/Jm603Fu9oM"
1192588887656296448,2019-11-07 16:45:22 MST,canadian_logic_,"@OfficialAli1776 @realDailyWire @MattWalshBlog its not guilt by association. Its guilt by direct policies, and action. The fact they are lauded by the alt right is just icing on the cake. reduced immigration to all countries majority of color WHILE asking for MORE immigration for countries of white population is a smoking gun"
1192588886267944962,2019-11-07 16:45:22 MST,parkyparis,WHAT KINDA DOCTOR WOULD BE LIKE “WAIT- BEFORE WE GIVE HIM THIS IMMEDIATE TRANSPLANT LETS CHECK HIS IMMIGRATION STATUS” ??????
1192588872292716544,2019-11-07 16:45:19 MST,andyrome64,@mightywhite83 @hendopolis @dellboychef I have already told you that several countries that have experienced faster population growth still manage to run good public health services. You want the problem to be immigration and Labour so I will leave you to your factless beliefs.
1192588863472099329,2019-11-07 16:45:16 MST,andrequerry,"«À défaut d’avoir des alliés économiques dans sa réforme controversée de l’immigration, le premier ministre François Legault se targue d’avoir une majorité d’appuis sur sa page Facebook.»    https://t.co/mINLFGWhWv"
1192588810397335552,2019-11-07 16:45:04 MST,tunnelbreeze,"@mrfrankowski ""Fine people fine people, total tradgedy if I may say so, total tagedy. Immigration policy a complete mess, a complete tragedy, I will give you some advice"" Donald Trump"
1192588798804267008,2019-11-07 16:45:01 MST,collinjustice6,@SenSchumer Wow....... Says the one who shut down the govt to block enforcement of immigration laws......
1192588786775007233,2019-11-07 16:44:58 MST,fedtanyl,@Polit_eurOpines The Libertarian Party’s position on free trade and immigration would do more good for the poor than any redistributive program these folks would support
1192588771490967553,2019-11-07 16:44:55 MST,realtalktruthd,"@HannahNaylor11 Younger people I feel are more invested in climate change, inequalities in ALL arenas, immigration policies that are fair, how the world views us &amp; yearn to stem the hate now rampant. I do appreciate Yang and Pete, but will vote for the nomination as the older candidates polling"
1192588708161236993,2019-11-07 16:44:39 MST,georgiavrakas,"Once again, a PR disaster for #Quebec at an #international level to boot! @francoislegault and @SJB_CAQ  should get informed on how PhD dissertations work. #immigration #phD #peqinjustice #PEQ #polqc #AssNat"
1192588701932507137,2019-11-07 16:44:38 MST,lib_gold_dragon,@EuroTrash16 @FernandoAmandi @Margueritekarak @CpcorpOrw @sebastianpinera Immigration has nothing to do with the violence in Chile. It's the local and regional left that caused the problem.  It's the classic scapegoat of nationalists-conservatives to believe that immigrants are the root of all problems.
1192588596764708867,2019-11-07 16:44:13 MST,barbforjesus,"Judicial Watch - Sheriff Who Frees Illegal Alien Convicted of Child Sex Crimes Says Enforcing Immigration Law Not Part of His Duties -   I guess upholding the law, isn't a part of his duty either!!    https://t.co/bo92315OV9"
1192588546399358976,2019-11-07 16:44:01 MST,mrcleanqs,"@jmdobkin @alyssaaroberts @NatImmForum @SenatorDurbin @SenCoryGardner @CoryGardner Jerrod - You're right that ""Gardner introduced bills with Bennet on immigration reform"". But when Trump abandoned those bills what did #CowardlyCory do? He tried to pin the blame on Democrats like pathetic partisan hack.  https://t.co/lgsYfWYIY2"
1192588468263641088,2019-11-07 16:43:42 MST,minister_bo,"@MeghanMcCain You  for mentioning the Khan ""Gold star"" family. ""Con"" family would be more appropriate and were staged intentionally to cause trouble. Khan is an immigration activist, and I hope some of his work ends up in you living room. Shame. Put you Demo/Commie hat on."
1192588414169821184,2019-11-07 16:43:29 MST,failstater,"this immigration plan, while it does not abolish ice, is very good.  https://t.co/JhLxpPXSAx"
1192588398017548288,2019-11-07 16:43:25 MST,everybrokenwave,BBC News - Quebec denies French student's immigration over English thesis chapter  https://t.co/x1ezHwCw73 What a disgrace by the province
1192588384239259648,2019-11-07 16:43:22 MST,zazafl,.@LeoVaradkar &amp; his dogwhistles to #racism  Taoiseach in attack on illegal immigration  https://t.co/XSGO26HWVA #EndDP #EndDirectProvision #RefugeesWelcome #noborders
1192588343470698497,2019-11-07 16:43:12 MST,pkjaimitmonnom,@Djinnamoureux From CTV: This comes after Quebec Immigration Minister Simon Jolin-Barrette said Monday that newcomers to the province should be obliged to receive all government documents in French.He added that only the “historic anglophone minority” would be allowed to have services in englis
1192588291427708928,2019-11-07 16:43:00 MST,hillbro4,"Let them all in!  And let them vote - as long as it's Democratic!  Sanders' immigration plan: Halt deportations, abolish ICE, welcome 50K 'climate migrants,' give welfare to all  https://t.co/O6gFU4yB0r"
1192588215745683456,2019-11-07 16:42:42 MST,catedore,"@IEC_EIC @lbeckett94 The immigration officer has ended the work permit on the PoE Letter expiry date. The second one this week and that’s several now in the past month. Unfortunately, even if the IECer knows the rules, it’s very difficult to persuade the border officer sometimes."
1192588059449188352,2019-11-07 16:42:05 MST,nytnational,"Migrant families split up at the border by the Trump administration's immigration policy must get psychological screening and counseling from the government, a federal judge ruled  https://t.co/0hrP0vvAKn"
1192588053421973504,2019-11-07 16:42:03 MST,iccouch,"@JulianCastro @RashidaTlaib @BernieSanders Funny, a little bit of google, and I found that 8 U.S.C 1325 was enacted in 1952.  The 82nd Congress (1951-1953) was controlled by a Democratic Senate (Alben Barkley) and Democratic House (Sam Rayburn).  This did update the immigration act of 1924 but dont lie to people."
1192588044626485249,2019-11-07 16:42:01 MST,joyj69957841,"@arjunhardas @DrAyeshaRay Whatever happened in the US decades ago has nothing do with Indian democracy.  The issue is, Modi wants to curb illegal immigration through subverting democracy &amp; enforce RSS anti-Muslim hatred based Hindutva ideology. It’s unconstitutional to ban specific religious groups."
1192587993652981760,2019-11-07 16:41:49 MST,itsclrkhns,"@diyadhiaa @whatsssupduck You can’t pinda our Immigration Act because simply it is not just undang-undang. It is an agreement too. If you want to pinda this, you required for leaders from Semenanjung, Sarawak &amp; Sabah to sit together. But knowing the immigration autonomy is sacred to us, it will not happen"
1192587980009025540,2019-11-07 16:41:46 MST,mrkesuke,@DannySearle3 @aidancrosbie @SenSanders You clearly don’t know what you’re talking about.  Austerity crippled the NHS not immigration.    Immigration actually supports the function of NHS.  Staff Levels &amp; significant contributions to National Insurance.  Are you pushing this because you want to believe it or just hate?
1192587978637533188,2019-11-07 16:41:45 MST,sohrabfracis,"Or (evoking the title of my novel): ""We won't go home."" #GoHome #GlobalCitizens #Immigration #Immigrants #ImmigrationMatters #immigrant #citizenship #CITIZEN #United #UnitedStates #UnitedNations #UniteToRemain #UnitedWeStand"
1192587975516971008,2019-11-07 16:41:45 MST,bearwitnessctl,"UPDATE: Bernie Immigration Plan: Halt ‘Racist’ Wall, Freeze Deportations, Extend Entitlement Benefits to Illegal Aliens READ:  https://t.co/DhGgXVHbAW #pjnet #HAction #hillaryemails #2A #tcot  https://t.co/3Iqt1wp1mA"
1192587955606560769,2019-11-07 16:41:40 MST,privacysetting1,"@tomselliott Can we all just agree that NOBODY on a CNN panel has ANY idea why people like Donald Trump..  If Bloomberg hasn't campaigned on lowering taxes, fixing trade deals, deregulation, growing the economy, deswamping DC, fixing immigration and putting America first..  He's got no shot"
1192587952083345408,2019-11-07 16:41:39 MST,ynotgreencards,"@cyrusmehta ""Toxic legacy""? I predicted H-1B hikes wd cause  green card backlog 20 years ago.  Big Tech formed Immigration Voice 2 make backlogs larger, wider &amp; last longer.   Yet u endorsed their zero sum bill.  We've asked u 2 at least condemn attacks on Durbin.  Well?  RT!  @supallofus  https://t.co/FsRTs15IZK"
1192587949986254855,2019-11-07 16:41:39 MST,floali555,"@DominikRockOn @francoislegault Ce qu'ils ont supposément oublié dans la liste en avons nous vraiment besoin dans le moment,il sera toujours temps de les ajouter en cours de route,le problème qu'on a avec l'immigration c'est qu'on n'est pas capable de retourner dans un délai résonnable ceux qui ne sont ps aptes"
1192587858235838466,2019-11-07 16:41:17 MST,reussircanada,RÉUSSIR CANADA IMMIGRATION TE GUIA Y TE ACOMPAÑA DURANTE TODO EL PROCESO DE EMIGRAR A CANADA !  UN AMIGO EN QUIEN CONFIAR !  CONSULTANOS PARA TENER EL PRIVILEGIO DE ORIENTARTE !  Carlos...  https://t.co/HHn7Usxvp7
1192587839952891906,2019-11-07 16:41:12 MST,jonaslaurince,Fermeture des services de la citoyenneté et de l’immigration des États-Unis #Haïti #Diplomatie #Haiti #Diplomacy #USA #Citizenship #Immigration   https://t.co/QpquHEfRwK
1192587837293703168,2019-11-07 16:41:12 MST,ryan7rosen,@charliekirk11 Rich guy trying to convince poor people the reason they are poor is immigration.  Bravo Charlie!  https://t.co/1C1cweKkfU
1192587826551914497,2019-11-07 16:41:09 MST,rightrealruby,"@mamendoza480 @AngelFamilies You have got to be kidding me. These  Federal ""want-to-be President"" judges want us to give them therapy because it was difficult breaking our immigration laws!?"
1192587813146877952,2019-11-07 16:41:06 MST,prioritydate, https://t.co/Nub7ea3gag Bernie Sanders’s immigration plan and the rights of immigrant workers -  https://t.co/QztgSEeOmI  https://t.co/zffMzVMSzd  https://t.co/21cjFwAGip
1192587808512151552,2019-11-07 16:41:05 MST,msbhavens1,"Bernie's immigration plan includes bringing immigration courts into the judicial system. One of the things that has ALWAYS horrified me is that the Immigration Courts are NOT in the judicial system. As Always, THANK YOU BERNIE! #BernieStandsWithUS #BernieBecauseHindsightIs2020"
1192587799075131392,2019-11-07 16:41:03 MST,philoux_99,@NickieVero @maxlafff @Robert_Deragon @oclupak2 Eh oui! Solution plus simple que l'immigration: augmenter les salaires et les avantages sociaux...
1192587793639366657,2019-11-07 16:41:01 MST,colmanofguaire,"Imagine an Irish liberal saying: 'The Nigerians went everywhere - all over Africa, to Ireland, to the UK, to the U.S &amp; Canada. With their history of immigration, they of all people have no right to complain about European immigration to Nigeria.'  Nope, I can't imagine it either."
1192587787435986947,2019-11-07 16:41:00 MST,thechelstalks,@al_malik98 @loosecannon67 @bbcquestiontime Have the ability to make our own laws ✅  Ability to make a skills based immigration system ✅  Having our own trade policy ✅  Sees an end to sending vast sums of money to the EU ✅  Sounds pretty independent to me 🤷🏻‍♂️
1192587755601031168,2019-11-07 16:40:52 MST,arjunhardas,@DrAyeshaRay So you really think govt officials base their decisions on books? In any case I did not say he lied. I said willful or inadvertent omission. You're a known Prof. Does that allow you to waltz in and out of the US freely with no immigration checks at all?
1192587733027315712,2019-11-07 16:40:47 MST,hyggepost,A #Greek #nationalist group has caused an #uproar with its plans to #protest #immigration by grilling pork and drinking beer outside a #camp full of #Muslim #asylum #seekers ...  https://t.co/4djsuJCJdh
1192587685543792641,2019-11-07 16:40:36 MST,thdarkjedi_,"Quand l'élite, les parvenus, les médias et les libéraux sont contre un projet de loi sur l'immigration, tu sais que tu as frappé dans le mille et que leur agenda mondialiste est menacé! #polqc #pq #plq #caq #Immigration"
1192587678161596416,2019-11-07 16:40:34 MST,deanpor72648316,Quebec denies French citizen's immigration application because 1 chapter of thesis was in English  https://t.co/7E8OlJJvT0 via @Yahoo
1192587667172577280,2019-11-07 16:40:31 MST,dgendvil,Sanders campaign manager thanks Castro for 'leadership' on immigration  https://t.co/kyUTjvigOM
1192587632322236419,2019-11-07 16:40:23 MST,eeesha12,#lumportofhope LUM immigration Lafayette IN  https://t.co/0dOLsj4Pou
1192587628249567232,2019-11-07 16:40:22 MST,lilytheyoshi,Mexicans complaining about immigration laws and protesting trumps wall should NOT turn a blind eye to the black lives matter movement . That’s hypocrisy. Help each other out man.
1192587607420653568,2019-11-07 16:40:17 MST,siphuncle12,@muzzavilla @SkyNews Classic political tactic. Pass the buck. Its immigration. It's Corbyn. It's Labour. It's someone else's fault. The government has failed and this election will be the end for them. Or it might not be. Depends on the size of your balls.
1192587574486822912,2019-11-07 16:40:09 MST,shnrch33,Judicial Watch - Sheriff Who Frees Illegal Alien Convicted of Child Sex Crimes Says Enforcing Immigration Law Not Part of His Duties -  https://t.co/RL0qAPIq2B
1192587560515538945,2019-11-07 16:40:06 MST,aldrichpatrick,"@varadmehta @AviWoolf I guess, but previous incarnations of Bernie were pretty anti-immigration when that position aligned with the views of labor."
1192587555306430464,2019-11-07 16:40:05 MST,ct_turnip,Pathway to citizenship for people who broke our immigration laws?  I’m sure many are great people but we already let a million per year in legally. Seems like a good number.  Until we rigorously enforce our immigration laws the problem won’t abate.
1192587552802385920,2019-11-07 16:40:04 MST,hoosierfamilies,#LUMPORTOFHOPE  TELL US YOUR IMMIGRATION STORY   #LUMPORTOFHOPE (@lumportofhope)  https://t.co/thsk8CaVDd
1192587550285799424,2019-11-07 16:40:03 MST,alwaysthemama,Michelle Malkin Blasts Republican Immigration Schemes As GOP Gets Thumped in Virginia Election - Big League Politics  https://t.co/fK3T0B2eXx
1192587530543206404,2019-11-07 16:39:59 MST,lawrencelott9,"@RealityCheckout @AirCop264 Mass immigration it's what they want in America and it's already happened with Talib , Omar and the squad as there called pushing oppression ,these people hate western civilization and hope to bring it's death from the inside backed by Soros and his lackies!"
1192587509777207301,2019-11-07 16:39:54 MST,virgoferreum,ALSO it’s becoming more and more apparent to me how vital criminal defense is to immigration
1192587443486281728,2019-11-07 16:39:38 MST,medardo_cardona,@mtlgazette I agree citing FB support is not valid but I do agree we need immigration reforms in Québec. Immigrants who don’t agree with the reforms should go to another province.
1192587425706598400,2019-11-07 16:39:34 MST,amyharlib,"Erika mobilized for her community so no one would have to face what she did when her mother and brother were taken by immigration officials. Now, she is urging people to use their courage and privilege to fight for others.  https://t.co/fqSU8pJHkP"
1192587422233747458,2019-11-07 16:39:33 MST,titrespresse,"(France TV Info): #Mesures sur l'immigration, évacuation de camps de migrants, réforme des retraites, fait religieux en entreprise, #Alexandre Benalla... Les informés du 7 novembre : Tous les soirs les informés débattent de..  https://t.co/4rx3ltvrt8  https://t.co/kPnw8D2Sc8"
1192587306076712961,2019-11-07 16:39:05 MST,1dailynewsnet,Opinion | How to Beat Trump on Immigration  https://t.co/ZLniGeAKSc
1192587301639131136,2019-11-07 16:39:04 MST,pierrecheynet,Quand par ta faute la maison brûle mais que tu te réjouis que la température du brasier ait baissé d’un demi degré... #ResponsablesEtCoupables #Emeutes #Immigration
1192587289177792512,2019-11-07 16:39:01 MST,bethluise,Immigration Activist Marco Saavedra Heads to Final Asylum Hearing  https://t.co/AIOx7Yp659 via @democracynow
1192587288682881024,2019-11-07 16:39:01 MST,sanajabeen_21,#MUFC #prophetofhumanity #ایک_بات_پوچھوں_ماروگے_تونہیں #Rashford #babarbinatta #ps86 #EXODEUX #Dadu Pakistan opens immigration centre at Kartarpur border  https://t.co/6ROvw5MxIW
1192587272459190272,2019-11-07 16:38:57 MST,lesphillips17,"Sanders' immigration plan: Halt deportations, abolish ICE, welcome 50K 'climate migrants,' give welfare to all  https://t.co/b5j0UTFcJj #FoxNews Welfare for all......IDIOT"
1192587253052084224,2019-11-07 16:38:52 MST,djagitator,"I Am American. 🇺🇸I love this County too. It has progressed through immigration, open borders, and open minded individuals willing to push the planet forward &amp; built this country. No small backwards thinking group will change it forever. 🎭 @realDonaldTrump  https://t.co/XDdEWVPOCH"
1192587232214949888,2019-11-07 16:38:48 MST,4emeetage,Qu'est-ce qu'on s'embête à lutter contre le voile à l'école tout en favorisant l'immigration musulmane ?  Dans quelques années on aura des instits voilées...
1192587218046590976,2019-11-07 16:38:44 MST,carolcollinslv,French police dismantle migrant camps in Paris as immigration measures toughen  https://t.co/7OFDdFl8y0
1192587213634260995,2019-11-07 16:38:43 MST,tracreports,"""The United States needs a fact-based immigration court system,"" said the group's president Ashley Tabaddor after reading TRACs report on EOIR's data mishandling.  Immigration Judges' Union Asks White House for Accurate Asylum Data (from @newsmax)   https://t.co/xzB9ynuCL3"
1192587174996303876,2019-11-07 16:38:34 MST,siphuncle12,@muzzavilla @SkyNews I think you've been brainwashed. You might still vote for the billionaires but I don't understand why. Immigration doesn't harm you. The government are in control of the country and they've failed to make the people of the UK feel OK. But they've passed the blame.
1192587106125791233,2019-11-07 16:38:17 MST,notfromshrek,"🛬 🚴‍♂️, 👸🏼: *waiting in line for immigration* 🚴‍♂️: This line would be much better if I could Tweet."
1192587102191542272,2019-11-07 16:38:17 MST,botrepublican,Also great to see firsthand the federal immigration
1192587086811009025,2019-11-07 16:38:13 MST,george28601554,"@BRedacted @Zod14_ Yep, that's right!!.. In immigration matter, the Germans followed the good example of the Americans!!...  Or maybe, it's viceversa!.. LOL.."
1192587086387433472,2019-11-07 16:38:13 MST,flobins_world,@PapaDocStrunsee @BernieSanders Because speeding is totally in the same league as illegal immigration 🙄
1192587020113043456,2019-11-07 16:37:57 MST,rhl15738352,FACT 8 - #s386 Do you know United States immigration rules are mostly unchanged since 50 years? @realDonaldTrump pls change these insane rules around immigration that allow million people to come to US but most of them dont contribute anything to the US. @BrietbartNews
1192586973443248135,2019-11-07 16:37:46 MST,u2biker,Dimms Bernie's new immigration plan allows everyone in &amp; gives them all welfare... DoG  https://t.co/Fd0RiEzTGD
1192586958880542720,2019-11-07 16:37:42 MST,scott_satzer,@thedianamoreno @BernieSanders Amazing! Generations unite in the fight for a better life!!  We must pass humane immigration reform!!  #IKnowWhereICameFrom #NotMeUs
1192586853431427077,2019-11-07 16:37:17 MST,mrcleanqs,"@SenCoryGardner @jmdobkin @NatImmForum Oh, that's right. #CowardlyCory is leading on immigration reform by helping Trump WASTE BILLIONS of our taxpayer dollars on a wall that can be cut through by a $100 saw.    https://t.co/EPGaZDlnEC"
1192586822133530624,2019-11-07 16:37:10 MST,mrcleanqs,"@jasiciliano @jmdobkin @SenCoryGardner Oh, that's right. #CowardlyCory is leading on immigration reform by helping Trump WASTE BILLIONS of our taxpayer dollars on a wall that can be cut through by a $100 saw.    https://t.co/EPGaZDlnEC"
1192586801669644288,2019-11-07 16:37:05 MST,markserrioz,@RyanAFournier Shouldn't she be deported for immigration fraud?
1192586612300894209,2019-11-07 16:36:20 MST,rosecomment,@john_mcguirk @MillieByrne12 @El_Lobo_14 @HGKrell @Oxfserendipity @fionamflanagan1 I just found out my Great grandfather from Britain was a Black man. No the last name is not related. But interesting. I still don’t believe in mass immigration.
1192586601769115648,2019-11-07 16:36:17 MST,cueckert,@BenediktAmrhein @TedLpd @PuffDomino @LepapillonBlu @simplyjustbeing @WomanRises @chromasphere @kodiak149 @Scoot4002 @crzyfkinworld @SDDNP @Roseymelhill @stepheni_miller @TheDivineMsLLS @theriddle17 @Colenfruhling @BigTyrion @DoubleClefMgmt @Michele40370757 @PTekach @lezleedee2 @KenobiCheated @SizzleBeauty @CarreraRoz @zen4ever2us @gr888shopper @popsablaze @CarlyJA22 @IamZelda93 @KathJohnsonArt @OaxacaXochitl @ReesusP @YetiEye @jose_fiasco @jankybrain @snarkgrapefruit @RhymesRadical @SadieTNResist @Noid68 @CajunBlueAZ1 @Kokomothegreat @LSD122070 @Nicoxw1 @bright8694 @BlueR00n @eddsmitty @GhostOfLuv3 I pray we legalize immigrants crossing the way they do. #Immigration #TheResistance
1192586592193536000,2019-11-07 16:36:15 MST,helpmerhonda49,Bernie Sanders proposes to ‘break up’ ICE and halt deportations in immigration plan -  https://t.co/tAhFLiXgPY - @washtimes
1192586583872069632,2019-11-07 16:36:13 MST,jdifrancis,Minnesota Town Hikes Taxes as Mass Immigration Overwhelms Schools  https://t.co/MuOusaMqxz
1192586569649016832,2019-11-07 16:36:10 MST,njstone9,@jonlis1 But Labour will try to introduce as few barriers as possible to EU immigration so that they can use this deceptive language in the same way they kept pretending access to the SM was the same as membership of it back in 2017.  You're a journalist. It's your job to be accurate.
