id,created_at,username,tweet
1192592567134773249,2019-11-07 16:59:59 MST,newlandchase,NEW ZEALAND: #Immigration New Zealand (INZ) has announced a targeted review of the Australian and New Zealand Standard Classification of Occupations (ANZSCO) job classification system.  https://t.co/hFmZRJS2pm #globalmobility
1192592547085877248,2019-11-07 16:59:55 MST,dictatorremoval,"@SCH41076287 @realDonaldTrump I would say the immigration laws are gonna change soon from welcoming to not welcoming, don’t waste time and money."
1192592539867656193,2019-11-07 16:59:53 MST,biscuitsgod,"@iamhuwman @MrMasonMills The bulk of ""immigration"" is from outside the EU, which is under our control anyway."
1192592523274772480,2019-11-07 16:59:49 MST,noswad7707,@GavinNewsom @senatemajldr What about our brave hero deputy Ishmael that was killed because of your failed policies on illegal immigration?
1192592445285883905,2019-11-07 16:59:30 MST,al_soff,"@SkyNewsAust @ScottMorrisonMP All for Climate Change crazies, pro China, Aboriginal's Chamber, Refugees, massive immigration, pro return of ISIS fighters, Medevac. Shorten was also not supportive of mining jobs, against self funded retirees and ignoring the aspirational Australians. Strategy to win??"
1192592427929997312,2019-11-07 16:59:26 MST,courthousenews,Bernie Sanders Vows to Undo Trump Immigration Policies  https://t.co/ixRHPKlxGf
1192592349706248192,2019-11-07 16:59:08 MST,markriveraabc7,"Just a football field away: CBP patrols river at US-Mexico border to enforce immigration law, stop drugs:    https://t.co/a9vQj6D5H6 @ABC7Chicago"
1192592323621916673,2019-11-07 16:59:01 MST,jostonjustice,#Immigration: Evidence supports conclusion that 'separating parents from children causes severe mental trauma that is aggravated if it is not timely treated.' Mental health services offered are 'insufficient' etc. [p. 35].
1192592304592306176,2019-11-07 16:58:57 MST,felix_hubert,"Immigration : ""Jamais aucun gouvernement n'avait osé s'en prendre au droit à la santé des demandeurs d'asile"" dénonce Médecins du Monde  https://t.co/jLWrDOaqdG via @franceinfo"
1192592300351705088,2019-11-07 16:58:56 MST,conjunction77,@SelimSeesYou @FatherofKitties It's Rod Dreher's Law of Motivated Noticing applied to demography: You may only draw attention to the political effect of immigration if you are affirming it as progressive.  https://t.co/S8ADc7B0C2
1192592256999526402,2019-11-07 16:58:46 MST,lizthegrey,"(good fucking luck trying to _actually_ explain devrel to an immigration control officer lol. ""is it sales? kinda. is it support? kinda. is it marketing? kinda. are you paid to speak? only by my employer in my home country, who consider it a marketing expense."")"
1192592247310684160,2019-11-07 16:58:43 MST,rosettadrone,I don’t even like Warren’s ridiculously political pay scheme; I also don’t think any policy contingent on massive immigration reform passing will become reality... but I sure as HELL don’t need the useless hack who lost to Trump to tell me so. Ugh. F off.
1192592205396897792,2019-11-07 16:58:33 MST,carentergirl,"@indiegoddess @MalcolmAkeem_ @traceyecorder @BernieSanders So, we should give up on #Medicare4All, the right to form a #union, a just #immigration plan, education free from debt, and a future for our planet because the powers that be won't have it? Our survival depends on organizing and changing course no matter what."
1192592164670361601,2019-11-07 16:58:24 MST,plongaye,Fermeture des services de la citoyenneté et de l’immigration des États-Unis –  https://t.co/Fu9p3Buy8F
1192592152976674817,2019-11-07 16:58:21 MST,johnrei56777937,"@HumzaYousaf @AngelaHaggerty You were an embarrassment and very rude.  All you care about is an independent Scotland having mass immigration,  especially of Muslims.  You said once that independence would be Scotland's ""Arab Spring"".  😡"
1192592147419205633,2019-11-07 16:58:19 MST,trstdtravlr,did you overhear that ‘Bodies flew everywhere’: A border chase shows role U.S. citizens play in immigration smuggling
1192592144671883266,2019-11-07 16:58:19 MST,valutex1,"@thehill A Tax Cheat, A Immigration fraud, a Campaign Finance violator, what a hypocrite."
1192592125738668033,2019-11-07 16:58:14 MST,cindilalbrecht,"@marymarybeaches @ABC @MeghanMcCain Um, when he called out the woman calling Obama a Muslim, when he stood firm against torture, when he supported the gang of 8 immigration plan, do i need to go on???"
1192592057698848768,2019-11-07 16:57:58 MST,benghazi_ebooks,Battled Emptiness's Nondeductible's Generators Helm Affability Zinc's Immigration  #benghazi #tcot
1192592037020868611,2019-11-07 16:57:53 MST,repgracemeng,"We've been in contact w/ @DHSgov about concerns over an armored vehicle in #Ridgewood. The agency advised this was NOT an immigration raid, but an arrest in which many dangerous weapons were taken off the street. We’re continuing to follow the situation &amp; obtain more info."
1192592014866571265,2019-11-07 16:57:48 MST,cocosupercoco,Je fais un exposé sur l’immigration avec des gens qui rient pcq qqn qui risquait sa vie pour fuir la misère de son pays est resté bloqué 3h sur un mur qui a été construit pour faire obstacle à des gens comme lui je cite : « il s’est cru dans koh lanta »  https://t.co/L0MzGXNn53
1192591949435326464,2019-11-07 16:57:32 MST,enanoo_4g,How to Beat Trump on Immigration  https://t.co/PbL4RLV5o2
1192591886369865729,2019-11-07 16:57:17 MST,disolis,"@JournoGoose The wave of fake dates continued into Jan. 2019, per @CNN. Back then, the immigration court agency said it ""does not expect any further recurrence of this type of situation."" 3/  https://t.co/LDBfA0X1Be"
1192591816119345152,2019-11-07 16:57:00 MST,nicdanger619,"Bernie Sanders releases detailed immigration plan, including vow to 'break up ICE and CBP'  https://t.co/1I0TL2n4T3"
1192591807986593793,2019-11-07 16:56:58 MST,xonearth,"Erika mobilized for her community so no one would have to face what she did when her mother and brother were taken by immigration officials. Now, she is urging people to use their courage and privilege to fight for others.  https://t.co/lG4ab8YpnH"
1192591783206772736,2019-11-07 16:56:53 MST,seriouslyabk,"Sanders' immigration plan: Halt deportations, abolish ICE, welcome 50K 'climate migrants,' give welfare to all | Fox News  https://t.co/WQxPJd2q0C"
1192591697638776839,2019-11-07 16:56:32 MST,fawkeeu,@StandUp4Brexit Been controlled under a Tory policy of being in the tens of thousands for nearly 10 years. Resulted in the hundreds of thousands. Tories cannot comment on immigration numbers as they are appalling.
1192591603552010240,2019-11-07 16:56:10 MST,samysimas,Y’all mind if I call Bernie daddy cause that immigration policy slaps
1192591572585635842,2019-11-07 16:56:02 MST,sonofdecatur,Incoming Cenk saying Warren's immigration plan is just the same as Bernie. #tytlive
1192591446781648897,2019-11-07 16:55:32 MST,johnfmiller86,"@HPluckrose Racism is incredibly important. Without racism, a very large voting block would no longer overwhelmingly vote Democrat (black people). We'd have no pretext for mass immigration (wage deflation). We'd have no diversity industry. Tens of thousands of news articles published daily"
1192591377802022913,2019-11-07 16:55:16 MST,rayhagarnv,"#NVnewsmakers: @MarkAmodeiNV2, others in US House try ""to break the ice' on immigration reform with agriculture workers-only bill.  https://t.co/GzRMrHDnDW"
1192591350635671553,2019-11-07 16:55:09 MST,flanagan72john,"Sanders' immigration plan: Halt deportations, abolish ICE, welcome 50K 'climate migrants,' give welfare to all  https://t.co/34FfL5pa4l Pandering for votes by a senile fool that should have vapor-locked weeks ago."
1192591329068539904,2019-11-07 16:55:04 MST,2monkeystravel,The @PanPacific staff waited 45 minutes for us to get out of the immigration! #ShareYourMoments @BDTourismBoard #bangladesh #beautifulbangladesh #visitbangladesh #thisisbangladesh #bangladesh #naturalbangladesh #madeinbangladesh  https://t.co/7SOJRhjcFW  https://t.co/sl0COTCUBU
1192591318062698503,2019-11-07 16:55:02 MST,rimnouvelles,"Le ministère de l'Immigration, de la Francisation et de l'Intégration déploie une nouvelle ressource dans Memphrémagog @MRCMemphre  -  https://t.co/Cf63KobEAu #Estrie #Economie"
1192591307576938496,2019-11-07 16:54:59 MST,joyanne1960,"Excellent. But on day one, those ""immigration centers"" should be shut down &amp; private prisons should be replaced by military medical units."
1192591299293126656,2019-11-07 16:54:57 MST,nathrochefort,Réforme de l'immigration : témoignages de celles et ceux qui ont failli tout quitter  https://t.co/ncQwemsPIc
1192591250651779073,2019-11-07 16:54:46 MST,pamnsc,"@AhsatanDranreb @matteosalvinimi He ABSTAINED from the antisemitism vote. With the league party, against Illegal immigration and look what he did to this death camp survivor ! No wonder Italian Jews don't trust him !"
1192591226668822529,2019-11-07 16:54:40 MST,johnsim19408099,"Are you saying that immigration laws are now irrelevant, and can therefore be ignored by anyone, for any reason?  Fantastic. All my friends in South Africa, who aren't eligible for British residency, can now just hop on a plane and come here.  You really are a plank. 🤔🙄😒🤨🤦‍♂️"
1192591218200453125,2019-11-07 16:54:38 MST,refugee2000,"@BernieSanders My Great, Great Grandfather and Grandmother came to America in 1846 to escape the Irish famine.  So what?  It is irrelevant to consideration of the question of what is good for the country &amp; earth right NOW. Mass immigration hurts the poor, increases population and CO2 emissions."
1192591214085910528,2019-11-07 16:54:37 MST,wolfeglenda,Historically low US birth rates will put a strain on our ‘entitlements systems’ &amp; immigration can help offset it? Is it just me or does this not make sense? Not enough $ going in? Why not stop all that is going out. Especially to those immigrants illegally now? Chicken or egg?
1192591152450539520,2019-11-07 16:54:22 MST,tonycorbey,@jeremycorbyn Your lot started the rot Jeremy by letting everyone into  https://t.co/AelnKyshvo you want to have Open borders and no immigration centres .The last time Labour were in power a note was left in Treasury spent it all !
1192591098876715013,2019-11-07 16:54:09 MST,scott_satzer,Therrrre we go. Trending.  Please share your family's immigration stories or why you stand for a humane immigration system like Bernie  will deliver!  Share with #IKnowWhereICameFrom!   #Bernie2020 #NotMeUs  https://t.co/t4EVf7xgOY
1192591078551117824,2019-11-07 16:54:05 MST,zynnnie,"Gov. BC Andrew Cuomo signed the controversial bill into law after the state attorney general assured him it couldn't be ""weaponized"" by immigration authorities.  https://t.co/5IuIZ3QToA # via @HuffPostPol"
1192591065909469184,2019-11-07 16:54:02 MST,creechjeff,"@SenSchumer Not only did Menashi write the it illegal policy to collect the debt students were scammed out of by these scam universities, he also wrote policy for white ethnocentric immigration. He is not fit to practice law let alone be a judge on the second highest court in the nation."
1192591055465545729,2019-11-07 16:53:59 MST,azinat707,"""Among independents and self-identified Democrats, Bernie Sanders was the preferred candidate in every policy category, which included ‘immigration,’ ‘health care,’ ‘the environment’ and ‘the economy and jobs.'”   https://t.co/OOyzB2NEL2"
1192591050453520384,2019-11-07 16:53:58 MST,cynthia45269,@BetzPete @BlueRobotDesign @real_defender @realDonaldTrump True   I do have commonalities but when I’m pushed for my beliefs I will fight back hard. I am for immigration that’s how we all got here to begin with but it needs to be overhauled correctly.
1192591010108338176,2019-11-07 16:53:48 MST,soul_of_a_sage,"@NZHeadliner @GrahamMatahu Sad part is, while immigration continues we are further away from resolving the existing problems of infrastructure, housing and poverty. Absolutely nothing changed."
1192590937672814592,2019-11-07 16:53:31 MST,litlgrey,"To Create 'Welcoming and Safe Nation for All,' Sanders Immigration Plan Would End Family Separations, Break Up ICE, and Tackle Root Causes -  https://t.co/Fh0wbeYS0X via @commondreams"
1192590895205568512,2019-11-07 16:53:21 MST,dsa_immigration,We have a moral obligation to retweet all the incredible @DemSocialists organizers posting #IKnowWhereICameFrom stories to amplify @BernieSanders's diverse base and powerful immigration platform.   (DM us if we missed yours!)
1192590891040616448,2019-11-07 16:53:20 MST,osca_teneotica,@mvintageretro @RasLeBo59421535 @ervaaaaaaan @stephanephanou @RMCinfo Nan mais vraiment madame (si vous le préférez à « meuf ») allez continuer à ressentir ce que vous voulez et chouiner sur Twitter mais arrêtez de vous prendre pour une spécialiste en matière d’immigration vos larmes ne sont pas des données qui ont quelconque valeur informative
1192590822417600512,2019-11-07 16:53:03 MST,reidmediaagency,"Bernie Sanders releases detailed immigration plan, including vow to 'break up ICE and CBP'  https://t.co/hUTWG0Wljv by @TUSK81"
1192590816377749513,2019-11-07 16:53:02 MST,marionlouise,One of the most civilised countries #Australia and the immigration system is down 😡😡 what a joke
1192590807808839680,2019-11-07 16:53:00 MST,jesuistinkerbel,@val_tigress Calling for laws against hate. Is this to shut up anyone who dare complain about enforced immigration? Is that why the right won't support it and she is now receiving threats? 🤔
1192590796857528321,2019-11-07 16:52:57 MST,classical_ali,@Canadian_logic_ @realDailyWire @MattWalshBlog He was asking for more immigration from 1st world countries. He didn’t say anything about race.
1192590774766051329,2019-11-07 16:52:52 MST,lizthegrey,"Experience flying to Bristol: (1) EasyJet gate-checked my bag even though there was room, b/c didn't pay fee for early boarding. (2) Long walk down to immigration hall. (3) Pulled out of egate line and racially profiled (4) bag was at claim upon arrival, because (2) and (3)."
1192590725910630407,2019-11-07 16:52:40 MST,george1991128,Quebec denies French student's immigration over English thesis chapter  https://t.co/fj2oI2Fu8I
1192590704691814400,2019-11-07 16:52:35 MST,votepursglove,"@ali00713 Some might say I've ""banged on about Brexit"" quite a lot in my time... 🙄 But to repeat: local people in #CorbyEN voted to control our own borders and have a fairer immigration system, make our own trade policy and our own laws, and spend our own money. That's what we'll do."
1192590659703566336,2019-11-07 16:52:25 MST,jon23399797,"@bronzeagemantis ""Ben, the period between between 1945-75 is called the Golden Age of capitalism--but there was minuscule immigration into America, Wall Street was emasculated, and corporations put America first. Wat means?"""
1192590645384404994,2019-11-07 16:52:21 MST,france_laurent,"@pebayf @francoislegault Honte, en effet! Quand on est rendu à invoquer des commentaires sur FB, c’est qu’on est à court d’arguments solides et valables. M. le PM, vous devriez plutôt vous en remettre aux avis éclairés et sérieux des acteurs clés (enseignement, monde des affaires, économie, immigration)."
1192590636920131584,2019-11-07 16:52:19 MST,robamerman,"This is why Bernie will win.  Our movement is about diversity, justice, and joy.  Whether the issue is #immigration, #MedicareForAll, the #GreenNewDeal, #CollegeForAll, or #FightFor15, this campaign is the revolution we need to save working class people.  #Bernie2020   #NotMeUs"
1192590635007524864,2019-11-07 16:52:19 MST,fe0r_bot,RT if you agree: We need an immigration system that honors our heritage as a nation of laws &amp; a nation of immigrants.  https://t.co/vapJWOHaNP
1192590623947145217,2019-11-07 16:52:16 MST,jonsellers11,"@january28150119 @WillCrain2 For 170+ years the US was a British colony. You can disagree with the ethics of colonialism, but it was what it was. Moving from the British isle to a British colony was not immigration. Immigration means leaving your home jurisdiction. My people didn't do that."
1192590615399346177,2019-11-07 16:52:14 MST,ogameplaysc,A schedule showing forces behind immigration and their effect on the experience that is immigrant  https://t.co/JN3tbFj9jJ
1192590593676976128,2019-11-07 16:52:09 MST,tomthunkitsmind,WHAT HAPPENED TO THE $4 BILLION CONGRESS APPROVED FOR IMMIGRATION?  https://t.co/UkK1tLHnjn
1192590561632542725,2019-11-07 16:52:01 MST,jamaislu,"Top story: Immigration: Legault s'en prend à la Chambre de commerce de Montréal  https://t.co/dBzwFgee7P, see more  https://t.co/ohS4j95Jcz"
1192590496029454337,2019-11-07 16:51:46 MST,theshockmaster6,"@OwlbearArmchair @EmmaHeward @ChrisJZullo @realDonaldTrump @DonaldJTrumpJr Except that illegal immigration is a at a record high for the first time in over thirteen years?  Oh, and PS? Calling the political opponent you don't like a ""fascist"" is sooooo 2016. ;)"
1192590422746386432,2019-11-07 16:51:28 MST,greenglazeinsky,#Quebec denies French student's immigration over English thesis chapter  https://t.co/AiSQeO9F2u
1192590371555028992,2019-11-07 16:51:16 MST,artistastrid,"Bernie ""we need borders because 'oh my god, there's a lot of poverty in this world'"" Sanders? Bernie ""just restructure ICE"" Sanders? Bernie ""come only if you can prove you'll contribute to the work force"" Sanders? HE'S your bold immigration reformist?"
1192590368040259584,2019-11-07 16:51:15 MST,artistastrid,"How are people saying Bernie Sanders is ""leading the way"" on immigration reform when a whole Julián Castro exists? #racism"
1192590296363806722,2019-11-07 16:50:58 MST,stephen19986759,"@StuartNorval @cloviscasali The people championing mass 3rd world immigration don't have to put up with it in their community, they drop them on the poor and they take town by town! These days in England you get called racist for stating facts!"
1192590220924862464,2019-11-07 16:50:40 MST,kdbuga,@larryelder @ThomasSowell Hence illegal immigration
1192590206848978945,2019-11-07 16:50:37 MST,ramsburgwilliam,Judicial Watch - Sheriff Who Frees Illegal Alien Convicted of Child Sex Crimes Says Enforcing Immigration Law Not Part of His Duties -  https://t.co/jxRx9EY23s  SHERIFF  NEEDS FIRED AND PROSECUTED FOR OBSTRUCTION AIDING AND ABETTING CRIMINAL ELEMENT'S ETC. AGAINST THE CITIZEN'S!!
1192590203942256640,2019-11-07 16:50:36 MST,gt7660412,"@DavidLammy Funny, the prime minister stood behind a lectern in Downing St and implied a Labour govt would result in uncontrolled immigration, unlike that with a Conservative govt. Setting aside his continuous despicable nods to narrow English nationalism/ racism, Tory record not so good."
1192590200641327104,2019-11-07 16:50:35 MST,rao4morrisville,Talking Immigration Reform in Morrisville for skilled immigrants! @GcReforms @Morrisville_NC @theRTP  https://t.co/Jevdj4858g
1192590195201368066,2019-11-07 16:50:34 MST,wilvfc,Quebec denies French student's immigration over English thesis chapter...wtf Quebec ? 😂😂😂  https://t.co/bAJmquYy21
1192590144693514241,2019-11-07 16:50:22 MST,queenbasmin,#HomeIsHere #DACA Immigration Support🌎  https://t.co/WrXWI2YECa
1192590132265803777,2019-11-07 16:50:19 MST,theshockmaster6,"@OwlbearArmchair @EmmaHeward @ChrisJZullo @realDonaldTrump @DonaldJTrumpJr Except, you know? It does? I'm pretty sure a moat filled with crocodiles would help deter illegal immigration too, so you might be onto something with the wall needing some additional spice as a deterrence."
1192590099130785793,2019-11-07 16:50:11 MST,bopinion,"Singapore chose to express its inventiveness and competence with its airport.  Changi Airport was designed to move passengers from gate, through immigration and customs and into the city (via excellent public transport) as quickly as possible  https://t.co/Gcb8l0tQqI  https://t.co/lNpk4P652D"
1192590074921152513,2019-11-07 16:50:05 MST,_slowrain_,"Wow! Not even the French are French enough. You stay classy, Quebec.  BBC News - Quebec denies French student's immigration over English thesis chapter  https://t.co/F91pn9KrPa"
1192590063651168256,2019-11-07 16:50:03 MST,schwartzchron,Houston police union demands firing of prosecutor accused of questioning victim's immigration status  https://t.co/vKN984HoR6 #hounews
1192590051680669696,2019-11-07 16:50:00 MST,axios,"The Supreme Court’s ultimate ruling on DACA will have implications not just for a narrow area of immigration policy but for U.S. security and its leadership role in the Americas, writes Expert Voices contributor @DenisMcDonough.  https://t.co/1Ppj6NkWAD"
1192590030239338497,2019-11-07 16:49:55 MST,donnacar62,@DemSocialist4US @sp33dstr @sunrisemvmt @BernieSanders @UWDAction @UNITEDWEDREAM @CosechaMovement @IndivisibleTeam @Dreamdefenders @CPDAction @350action That is the dumbest question ever. When people were establishing this new land we didn't have immigration laws because it was a wide-open frontier
1192589990376693760,2019-11-07 16:49:45 MST,jonatha72315495,@TheGreenParty @CarolineLucas @sianberry Yeah good point but peaple get ill anyway regardless. It's all down to immigration and population which is never mentioned
1192589940464455680,2019-11-07 16:49:33 MST,milatrud11,"France is to impose quotas on the number of Non-EU workers as part of measures aimed at addressing concerns about immigration, asylum and integration.  PM Philippe:""We want to take back control of our migration policy,""   https://t.co/WNu0kjxjHC Frankreich,Zuwanderung,Fachkräfte,"
1192589918582784000,2019-11-07 16:49:28 MST,bmorrow58,Quebec denies French citizen's immigration application because chapter of thesis was in English | CBC News  https://t.co/ZkTmwTv3Iw
1192589912156958720,2019-11-07 16:49:26 MST,halle2017,"@TomShafShafer @realDonaldTrump 😂😅😂. LOL. Lowest unemployment rate and for blacks, 2k + for middle class each. Pay increases. Stock -401ks grown by 26 percent or so since January, lowering illegal immigration (which saves us billions), could go on, but stick to your injured vanity that your candidate lost!"
1192589900383694848,2019-11-07 16:49:24 MST,oliviercyran,"@legisti 2 : Dans le même temps, le ""Plan immigration"" facho-compatible du gouvernement et pré-vendu dans un hebdomadaire d'extrême droite prévoit la construction à partir de 2020 de trois nouveaux centres de rétention administrative à ""grandes capacités d’accueil""."
1192589867898810368,2019-11-07 16:49:16 MST,marcothecoward,@marcorubio How about focusing on things like Healthcare or immigration or climate or infrastructure or gun control or equality or human rights or god forbid an actual Town Hall where you engage with actual citizens? No? Because you are a #COWARD little Marco. #resign
1192589854460272640,2019-11-07 16:49:13 MST,maniwagatari,@Rusty2Tone MIC WAS TELLING ME YOU'RE A FAN OF CHRISTMAS WITH THE VILLAGE AND ALL.... immigration let this man up here already
1192589828740698113,2019-11-07 16:49:07 MST,starfox6441,"@KingBaldwinIV @SelimSeesYou If he had gone hard on immigration in the first year, the controversy of it would all be way behind us by now. Any lawsuits would have gotten Supreme Court rulings by now, as well  Now I guess he'll have to campaign on it again, and/or issue a bunch of 11th hour executive orders"
1192589775385104389,2019-11-07 16:48:54 MST,aminanaili33,"@BBCWorld Quebec is very demanding on fluency in French. It is a selection criterion that favors French candidates for immigration. In general it is rather English, even in France and for many jobs."
1192589763846582272,2019-11-07 16:48:51 MST,trudeaudrunk,"YET THEY WANT TO UP IMMIGRATION LEVELS TO 350,000 A YEAR??? Oh Great, Now The Elites Are Talking About Population Control  https://t.co/W7hYCobLXf"
1192589760331702274,2019-11-07 16:48:50 MST,yb01,🙌🏽RT @GlobalGrind: Bernie Sanders' Immigration Plan Would Scrap ICE  https://t.co/TOsGVouhXt
1192589747538952192,2019-11-07 16:48:47 MST,hecate78,"@stephsmothrs Are you sure you are not taking my class?  I go in, expecting to lead a conversation about immigration and we end up talking about judgement and pop culture....lol"
1192589746893135872,2019-11-07 16:48:47 MST,harley_handy,Alabama Sheriff Stole $1.5M Meant To Feed Immigration Detainees  https://t.co/TOm7eMrzn9
1192589668216459271,2019-11-07 16:48:28 MST,dhgregory1952,"Sanders' immigration plan: Halt deportations, abolish ICE, welcome 50K 'climate migrants,' give welfare to all  https://t.co/BITSMtpI3D  No wonder he never made it in business.  Wages up and unemployment down is due to supply and demand.  More immigrants reverses that. Silly silly"
1192589522523099136,2019-11-07 16:47:54 MST,jason13122,Bernie Sanders’ Immigration Plan Vows 'Break Up' ICE and Stop Deportations -  https://t.co/wzGvU1Xmoe ✅ Via - @NeonNettle #NeonNettle
1192589464872214531,2019-11-07 16:47:40 MST,ainjulaikhaa,Sampai immigration je nervous😂 pastu jantung nak terkeluar bila kena tunjuk immigration card sbb lupa gila pasal benda tu. ingatkan dah hilang nasib baik ada 😭
1192589432504946689,2019-11-07 16:47:32 MST,mikamac,"For the next 4 years, Elmer Fudd would be an improvement over Trump, just get him out of office and stop the worldwide calamity .  THE best thing that America can do is return to the Paris Accord, support NATO and stop putting tariffs on everyone. + immigration &amp; infrastructure"
1192589430944604160,2019-11-07 16:47:32 MST,colmanofguaire,"Imagine a liberal saying to people in African countries, you guys have no right to oppose mass European immigration to your countries, because once upon a time there were signs in America saying ""No blacks.   I have the feeling the Africans might think the logic a tad bizarre."
